"",,,,L ist,a,d,Fes,e,Li,t,a,vr,V,os,irt,L,u i,v,,aro,l,d,,o d a,,,,U 2sp,,02,,1
"",,,,Preço de,,,,,,,,,,,,,,,,,,,,,,,,,,,,
Cód.,Título Cód. de Barras,Autor,,,,,,,Preço com desconto,,,,,,,,,,,,,,,,,,,,,,,
"",,,,Capa,,,,,,,,,,,,,,,,,,,,,,,,,,,,
12705,"""Questão Social"": particularidades no Brasil 9788524919466",Josiane Soares Santos,,"R$ 72,00",,,,,,,,,,,,"R$ 36,00",,,,,,,,,,,,,,,,
13400,100 palavras do marxismo 9788524923470,Michael Löwy,,"R$ 52,00",,,,,,,,,,,,"R$ 26,00",,,,,,,,,,,,,,,,
12999,"12 trabalhos de Hércules, Os 9788524920431",Marco Haurélio,,"R$ 55,00",,,,,,,,,,,,"R$ 27,50",,,,,,,,,,,,,,,,
11621,200 dias de leitura e escrita na escola 9788524911446,Rossana Ramos,,"R$ 57,00",,,,,,,,,,,,"R$ 28,50",,,,,,,,,,,,,,,,
13837,88 Histórias: contos e minicontos 9788524926839,Severino Rodrigues,,"R$ 46,00",,,,,,,,,,,,"R$ 23,00",,,,,,,,,,,,,,,,
14228,A Lua de Alice: 9786555550306,Carol Petrolini,,"R$ 55,00",,,,,,,,,,,,"R$ 27,50",,,,,,,,,,,,,,,,
12784,ABC dos direitos humanos 9788524920035,Dulce Seabra,,"R$ 55,00",,,,,,,,,,,,"R$ 27,50",,,,,,,,,,,,,,,,
12288,Abordagem triangular no ensino das artes e 9c7u8lt8u5r2as4 9v1is6u6a4is9,Ana Mae Barbosa,,"R$ 99,00",,,,,,,,,,,,"R$ 49,50",,,,,,,,,,,,,,,,
13621,Ações afirmativas no Brasil - V. 01 - Experiên9c7ia8s8 b5e2m49-2su5c0e7d8ida Ssa ndra Unbehaum,,,"R$ 75,00",,,,,,,,,,,,"R$ 37,50",,,,,,,,,,,,,,,,
13622,Ações afirmativas no Brasil - V. 02 - Experiên9c7ia8s8 b5e2m49-2su5c1e3d9ida Ssa ndra Unbehaum,,,"R$ 75,00",,,,,,,,,,,,"R$ 37,50",,,,,,,,,,,,,,,,
11793,Acolhendo crianças e adolescentes - experiê9n7c8ia8s5 d2e4 9p1ro2m30o6çã oIr deon e Rizzini,,,"R$ 62,00",,,,,,,,,,,,"R$ 31,00",,,,,,,,,,,,,,,,
13395,Adeus ao trabalho? - ensaio sobre as metam9o7r8fo8s5e2s4 e9 2a3 142,Ricardo Antunes,,"R$ 75,00",,,,,,,,,,,,"R$ 37,50",,,,,,,,,,,,,,,,
12137,"Adeus professor, adeus professora? - novas 9e7xi8g8ê5n2c4ia9s1 5949",José Carlos Libâneo,,"R$ 45,00",,,,,,,,,,,,"R$ 22,50",,,,,,,,,,,,,,,,
12711,Administração escolar - introdução crítica 9788524919541,Vitor Henrique Paro,,"R$ 68,00",,,,,,,,,,,,"R$ 34,00",,,,,,,,,,,,,,,,
13905,"Adolescências, direitos e medidas socioeduc9a7ti8v8a5s 2e4m9 2m7e2i3o2 ab Aelrdtoaíza Sposati",,,"R$ 46,00",,,,,,,,,,,,"R$ 23,00",,,,,,,,,,,,,,,,
13394,"Adolescente e o ato infracional, O 9788524923395",Mário Volpi,,"R$ 45,00",,,,,,,,,,,,"R$ 22,50",,,,,,,,,,,,,,,,
13867,"Adolescente, ato infracional e serviço social 9n7o8 j8u5d2ic4i9á2ri7o0 -4 T1ra bCailehnoe  Terra",,,"R$ 62,00",,,,,,,,,,,,"R$ 31,00",,,,,,,,,,,,,,,,
13217,Adolescentes privados de liberdade - a Norm9a7t8iv8a5 2N4a9c2io2n1a3l8 e  Mário Volpi,,,"R$ 67,00",,,,,,,,,,,,"R$ 33,50",,,,,,,,,,,,,,,,
12883,"Afetividade e letramento na educação de jov9e7n8s8 5e 2a4d9u2lt0o2s1 -9 EJ ASérgio Antônio da Silva LeitRe$ 68,00",,,,,,,,,,,,,,,"R$ 34,00",,,,,,,,,,,,,,,,
12633,Alfabetização cartográfica e a aprendizagem9 d7e8 8g5e2o4g9ra1f9ia077,Elza Yasuko Passini,,"R$ 72,00",,,,,,,,,,,,"R$ 36,00",,,,,,,,,,,,,,,,
12810,Alfabetização e leitura 9788524920042,José Juvêncio Barbosa,,"R$ 65,00",,,,,,,,,,,,"R$ 32,50",,,,,,,,,,,,,,,,
13376,Alfabetização em processo 9788524923258,Emilia Ferreiro,,"R$ 63,00",,,,,,,,,,,,"R$ 31,50",,,,,,,,,,,,,,,,
12949,Alfabetizar letrando com a literatura infantil9788524921155,Fábio Cardoso dos Santos,,"R$ 63,00",,,,,,,,,,,,"R$ 31,50",,,,,,,,,,,,,,,,
12950,Alfabetizar letrando com a tradição oral 9788524921148,Lenice Gomes,,"R$ 63,00",,,,,,,,,,,,"R$ 31,50",,,,,,,,,,,,,,,,
12948,Alfabetizar letrando na biblioteca escolar 9788524921131,Fabiano Moraes,,"R$ 63,00",,,,,,,,,,,,"R$ 31,50",,,,,,,,,,,,,,,,
12849,"Aluno incluído na educação básica, O - avalia9ç7ã8o8 5e2 p4e9r2m0a1n6ê5nc iMa arcos Cezar de Freitas",,,"R$ 46,00",,,,,,,,,,,,"R$ 23,00",,,,,,,,,,,,,,,,
12422,"Aluno-problema, O - forma social, ética e inc9l7u8sã8o524917509",Marcos Cezar de Freitas,,"R$ 46,00",,,,,,,,,,,,"R$ 23,00",,,,,,,,,,,,,,,,
12118,"Amazonas, As-a conquista do rio-mar pelo c9ap78it8ã5o2 F4r9a1n5ci6s1co1",Jô Oliveira,,"R$ 46,00",,,,,,,,,,,,"R$ 23,00",,,,,,,,,,,,,,,,
11936,"Ambição de Macbeth e a maldade feminina,9 A788524913310",Arievaldo Viana,,"R$ 47,00",,,,,,,,,,,,"R$ 23,50",,,,,,,,,,,,,,,,
12828,Ambientes digitais - reflexões teóricas e prát9ic7a8s8524920110,Denise Bértoli Braga,,"R$ 61,00",,,,,,,,,,,,"R$ 30,50",,,,,,,,,,,,,,,,
12404,"Amor e o ódio na vida do professor, O - pass9a7d8o8 e5 2p4re9s1e7n3t1e8 na A",na Archangelo,,"R$ 57,00",,,,,,,,,,,,"R$ 28,50",,,,,,,,,,,,,,,,
13929,Anacrônicas e quase inventadas 9788524927362,Anderson Novello,,"R$ 46,00",,,,,,,,,,,,"R$ 23,00",,,,,,,,,,,,,,,,
13364,Análise acústica da fala 9788524923319,Ray D. Kent,,"R$ 89,00",,,,,,,,,,,,"R$ 44,50",,,,,,,,,,,,,,,,
12830,Análise de textos de comunicação 9788524919527,Dominique Maingueneau,,"R$ 73,00",,,,,,,,,,,,"R$ 36,50",,,,,,,,,,,,,,,,
13717,Animais da cidade 9788524925924,Flávia Côrtes,,"R$ 65,00",,,,,,,,,,,,"R$ 32,50",,,,,,,,,,,,,,,,
13401,"Aniversário do Seu Alfabeto, O 9788524923494",Amir Piedade,,"R$ 45,00",,,,,,,,,,,,"R$ 22,50",,,,,,,,,,,,,,,,
13232,Aprendendo com os aprendizes - a construçã9o7 8d8e5 v2í4n9c2u2lo8s0 e0nt rGea briel Chalita,,,"R$ 51,00",,,,,,,,,,,,"R$ 25,50",,,,,,,,,,,,,,,,
13847,Aprender a cuidar: diálogos entre saúde e ed9u7c8a8ç5ã2o4 i9n2fa6n8t6i0l,Isabel de Oliveira e Silva,,"R$ 46,00",,,,,,,,,,,,"R$ 23,00",,,,,,,,,,,,,,,,
11728,Aprender a ensinar - a aprendizagem do ens9in7o8 8n5o2 c4u9r1so24 d0e5,"MARIA ISABEL BATISTA SERRR$A 6O5,00",,,,,,,,,,,,,,"R$ 32,50",,,,,,,,,,,,,,,,
12880,Aprender e ensinar com textos não escolare9s788524920158,Adilson Citelli,,"R$ 65,00",,,,,,,,,,,,"R$ 32,50",,,,,,,,,,,,,,,,
13427,Aprender e ensinar História nos anos iniciais9 d7o8 8E5n2si4n9o2 F2u0n2d2am Aennat aCllaudia Urban,,,"R$ 65,00",,,,,,,,,,,,"R$ 32,50",,,,,,,,,,,,,,,,
12612,"Aprender para ganhar, conhecer para com",e9t7ir8 8- 5so2b49re1 8a629,Licínio C. Lima,"R$ 46,00","R$ 23,00"
12544,"Aracaju, cidade das águas",9788524916939,Jorge Carvalho do Nasci,"eRn$to 46,00","R$ 23,00"
12337,Argumentação e linguagem,9788524916861,Ingedore G. Villaça Koc,"R$ 68,00","R$ 34,00"
13055,Arte em questões,9788524921933,Isabel A. Marques,"R$ 68,00","R$ 34,00"
11455,Arte/Educação contemporânea - consonâ,c9ia7s8 i8n5te2r4n9a1c1io0n9a5i,Ana Mae Barbosa,"R$ 89,00","R$ 44,50"
14230,As três tias de Matias,9786555550436,Anderson Novello,"R$ 47,00","R$ 23,50"
12390,"Asas do burro de Einstein, As - memórias",e9 u7m88 s5o2b4r9e1vi7v5e8n5t,dMoarcos Cezar de Freitas,"R$ 55,00","R$ 27,50"
14204,Ascensão da nova direita e colapso da sob,r9a7n8ia6 5p5o5lí5ti5ca0:122,Potyara Amazoneida Pe,"eirRa$ 72,00","R$ 36,00"
12564,Assassinato na Ilha de Boipeba,9788524918698,Roberto Melo,"R$ 55,00","R$ 27,50"
12758,Assédio moral contra mulheres nas organi,a9ç7õ8e8s524919817,Patrícia Maria Figuered,"R$ 69,00","R$ 34,50"
13053,Assistência na trajetória das políticas soci,is9 b7r8a8si5le2i4ra9s1 8- 4u6m9a,Aldaíza Sposati,"R$ 62,00","R$ 31,00"
13261,Assistência social e seus usuários - entre a,re9b7e8l8d5ia2 e4 9o2 3029,Marta Borba Silva,"R$ 68,00","R$ 34,00"
13542,Assistência social e trabalho no capitalism,9788524924286,Ivanete Boschetti,"R$ 64,00","R$ 32,00"
13378,"Assistência social entre a ordem e a ""des-","rd9e7m88""5 -2 m49is2t3if2ic3a4ç",o S edloms a Maria Schons,"R$ 72,00","R$ 36,00"
13503,"Assistente Social na luta de classes, A/O",9788524924187,Ana Maria de Vasconce,"osR$ 105,00","R$ 52,50"
11674,Assistentes sociais e religião - um estudo,ra9s7il8 /8 I5n2g4la9t1e1r8ra59,Pedro Simões,"R$ 67,00","R$ 33,50"
12082,Atividades com temas transversais,9788524915208,Sandra Branco,"R$ 46,00","R$ 23,00"
12374,"Ato de ler, O - fundamentos psicológicos p",r9a7 u8m85a2 n4o9v1a7 1P9e6d,g Eozgeiqa uiel Theodoro da Si,"vaR$ 46,00","R$ 23,00"
11598,"Audição, voz e linguagem - a clínica e o suj",i9to788524911583,Sandra Pavone,"R$ 73,00","R$ 36,50"
10133,Audiologia infantil,9788524901775,Iêda C. Pacheco Russo,"R$ 68,00","R$ 34,00"
12885,Autonomia da escola - princípios e propos,a9s788524917707,José Eustáquio Romão,"R$ 65,00","R$ 32,50"
13047,Autonomia e ética na escola - o novo map,d9a7 8e8d5u2c4a9çã2o1674,Mírian Paura S. Zippin,"rinsRp$u 4n6,00","R$ 23,00"
12310,Avaliação da aprendizagem - componente,d9o7 a8t8o5 p2e4d9a1g6ó5g7ic1o,Cipriano Luckesi,"R$ 89,00","R$ 44,50"
13241,Avaliação das aprendizagens - sua relação,o9m78 o8 5p2a4p9e2l 2so7c5i6al,d Cal audia de Oliveira Fern,"ndRe$s 63,00","R$ 31,50"
14183,Avaliação de Políticas Públicas e Garantia,e9 D7i8r8e5it2o4s927621,Silvia da Silva Tejadas,"R$ 63,00","R$ 31,50"
12426,Avaliação dialógica - desafios e perspectiv,s9788524917714,José Eustáquio Romão,"R$ 57,00","R$ 28,50"
13843,Avaliação em educação: questões epistem,l9ó7g8ic8a5s2 e4 9p2rá6t8ic5a3s,Cipriano Luckesi,"R$ 68,00","R$ 34,00"
13215,"Avaliando o Bolsa Família- unificação, foc",liz9a7ç8ã8o5 e2 4im92p2a0c8to4s,Maria Ozanira da Silva,"SilRva$ 63,00","R$ 31,50"
12685,Aventuras da epistemologia ambiental - d,a9r7ti8c8u5la2ç4ã9o1 d9a4s4 2ci,nEcniarisq ue Leff,"R$ 52,00","R$ 26,00"
12067,Aventuras de Pedro Malasartes (Nelson Al,i9ss7ú8)8524915048,Nelson Albissú,"R$ 56,00","R$ 28,00"
11822,"Barquinho e o marinheiro, O",9788524912795,Sami e Bill,"R$ 46,00","R$ 23,00"
13831,Base nacional comum curricular - Dilemas,9p7e8rs8p5e2c4t9iv2a6s846,Carlos Roberto Jamil Cu,"yR$ 54,00","R$ 27,00"
13815,"Bate, coração!",9788524926525,Lurdes Breda,"R$ 45,00","R$ 22,50"
11770,Belém - cidade das mangueiras,9788524912627,Darcy Flexa Di Paolo,"R$ 41,00","R$ 20,50"
13607,"Bifurcações da ordem, As - Revolução, cid","d9e7, 8c8a5m2p4o9 2e5 in0d16ig",aBçoãaoventura de Sousa Sa,"toRs$ 81,00","R$ 40,50"
11908,Boa Vista - boa de viver,9788524913679,Aimberê Freitas,"R$ 41,00","R$ 20,50"
11435,Bola no pé - a incrível história do futebol,9788524909931,Luisa Massarani,"R$ 46,00","R$ 23,00"
12879,Bolsa família no enfrentamento à pobreza,n9o7 M88a5ra2n4h9ã1o9 7e4 P9i,"u Mí, aOria Ozanira da Silva","SilRva$ 63,00","R$ 31,50"
13014,"Botão mágico, O",9788524921438,Leka,"R$ 41,00","R$ 20,50"
11398,Brasil em contra-reforma - desestruturaçã,9d7o8 E8s5t2ad4o90 e9 p8e1r8d,Edlea ine Rossetti Behring,"R$ 76,00","R$ 38,00"
11701,Brasília - de cerrado a capital da república,9788524912535,Lucília Garcez,"R$ 41,00","R$ 20,50"
12568,Brincar na educação infantil - uma história,q9u7e8 s8e5 r2e4p9e1t6e885,Gisela Wajskop,"R$ 46,00","R$ 23,00"
12248,"Brincar, conhecer, ensinar",9788524916427,Sanny S. da Rosa,"R$ 46,00","R$ 23,00"
12475,Brinquedoteca: Manual em educação e sa,d9e788524918322,Beatriz Piccolo Gimene,"R$ 78,00","R$ 39,00"
12445,Bullying não é amor!,9788524918308,Silmara Rascalha Casad,"iR$ 47,00","R$ 23,50"
13011,Cadê o sol?,9788524920660,Vera Lucia Dias,"R$ 45,00","R$ 22,50"
12026,"Caixinha de narizes, A",9788524914812,Liana Leão,"R$ 46,00","R$ 23,00"
13665,"Caminhão, O",9788524925542,Lúcia Hiratsuka,"R$ 47,00","R$ 23,50"
13067,"Cantina de Dona Calabresa, A",9788524921476,Liana Leão,"R$ 46,00","R$ 23,00"
14327,"Capitalismo explicado às crianças, O",9786555551310,Jean Ziegler,"R$ 57,00","R$ 28,50"
10630,Capitalismo monopolista e Serviço Social,9788524903946,José Paulo Netto,"R$ 63,00","R$ 31,50"
14274,Carta para Tia Tita,9786555550559,Elma,"R$ 41,00","R$ 20,50"
13918,"Casamentos da Dona Baratinha, Os",9788524927249,Elma,"R$ 41,00","R$ 20,50"
12249,"Categoria ""Questão Social"" em debate, A",9788524916359,Alejandra Pastorini,"R$ 46,00","R$ 23,00"
12362,Causos de Pedro Malasartes,9788524917134,Júlio Emílio Braz,"R$ 52,00","R$ 26,00"
14330,Centopeia sem pés,9786555551099,Eraldo Miranda,"R$ 41,00","R$ 20,50"
13008,Chapeuzinho de couro,9788524920424,Agostinho Ornellas,"R$ 52,00","R$ 26,00"
11961,"Cidade dos carregadores de pedras, A",9788524914119,Elma,"R$ 46,00","R$ 23,00"
13623,Classes subalternas e assistência social,9788524925153,Maria Carmelita Yazbek,"R$ 72,00","R$ 36,00"
12022,Coisas do folclore,9788524914706,Nelson Albissú,"R$ 47,00","R$ 23,50"
12720,"Colecionador de águas, O",9788524919596,Lúcia Hiratsuka,"R$ 46,00","R$ 23,00"
12150,Com todas as letras,9788524915758,Emilia Ferreiro,"R$ 45,00","R$ 22,50"
12171,Compreender e ensinar - por uma docênci,9d7a8 m85e2lh4o9r1 q6u0a7l6id,dTerezinha Azerêdo Rios,"R$ 57,00","R$ 28,50"
11713,Confusão no galinheiro - o caso dos ovos,e 9o7u8r8o524912047,Amir Piedade,"R$ 46,00","R$ 23,00"
13981,Congresso da Virada e o Serviço Social Hoj,:9788524927515,Maria Liduina de Oliveir,"eRS$il v6a5,00","R$ 32,50"
11400,Conhecimento prudente para uma vida de,e9n7t8e8 -5 '2u4m9 0d9is8c3u2rs,Boaventura de Sousa Sa,"toRs$ 125,00","R$ 62,50"
13524,Conscientização,9788524924279,Paulo Freire,"R$ 63,00","R$ 31,50"
12517,Conselhos gestores e participação sociopo,ít9ic7a88524917639,Maria da Gloria Gohn,"R$ 46,00","R$ 23,00"
12080,Contando o Hino Nacional,9788524915314,Marcos Vinícius Lúcio,"R$ 47,00","R$ 23,50"
12563,Contos de mistério & assombros,9788524918704,Nelson Albissú,"R$ 46,00","R$ 23,00"
13024,Contos encantados de Hans Christian And,rs9e7n88524920714,Luiz Antonio Aguiar,"R$ 49,00","R$ 24,50"
14193,CONTRARREFORMAS ou REVOLUÇÃO,9788524927645,Maria Lucia Teixeira Ga,"ciaR$ 72,00","R$ 36,00"
13412,Conversa com professores - do fundamen,al9 à7 8p8ó5s2-g4r9a2d3u5a0ç0ã,Newton Cesar Balzan,"R$ 78,00","R$ 39,00"
13952,Coordenação do trabalho pedagógico: do,r9o7je8t8o5 p2o4l9ít2ic7o3-24,Celso dos S. Vasconcell,"sR$ 76,00","R$ 38,00"
13244,Coordenador pedagógico e a formação co,t9ín7u8a8 5d2o4 d9o2c2e9n3t0e,aIs aneide Domingues,"R$ 63,00","R$ 31,50"
13048,"Cor do tempo quando foge, A - uma histór",a9 d7o8 8p5re2s4e9n2t1e6 C9r8ô,iBcaosa ventura de Sousa Sa,"toRs$ 115,00","R$ 57,50"
12637,Corpo em movimento na educação infanti,9788524919060,Vilma Lení Nista-Piccolo,"R$ 71,00","R$ 35,50"
13895,"Corporeidade, jogo, linguagem - a Educaç",o9 F7ís8i8ca5 2n4o9s2 a7n0o2s7,Mauro Betti,"R$ 71,00","R$ 35,50"
12142,Cortez - a saga de um sonhador,9788524916014,Teresa Sales,"R$ 59,00","R$ 29,50"
12667,Cotidiano: conhecimento e crítica,9788524919022,José Paulo Netto,"R$ 41,00","R$ 20,50"
12084,"Coyuntura actual, latinoamericana y mun",ia9l 7- 8t8en52d4e9n1ci5a2s1 y5,Carlos Montaño,"R$ 92,00","R$ 46,00"
12651,"Criança e seu desenvolvimento, A - perspe",t9iv7a8s8 p5a2r4a9 s1e8 2d5is4c,t Ziri lam a de Moraes Ramo,"deR O$l i6v3e,i0ra0","R$ 31,50"
12646,"Criança na fase inicial da escrita, A - a alfa",e9ti7z8a8çã5o2 4c9o1m8o6 81,Ana Luiza Bustamante S,"oRlk$a 63,00","R$ 31,50"
14334,"Crianças, educação e o direito à cidade:",9786555550795,Marcia Aparecida Gobbi,"R$ 65,00","R$ 32,50"
12643,"Crise das ciências humanas, A",9788524919190,Hilton Japiassu,"R$ 71,00","R$ 35,50"
14165,Crise do capital e fundo público: implicaçõ,"s9 p7a8r8a5 o2 4t9ra2b7a5l9h1o,",o Esl aine Rossetti Behring,"R$ 78,00","R$ 39,00"
12673,Crise do socialismo e ofensiva neoliberal,9788524919329,José Paulo Netto,"R$ 45,00","R$ 22,50"
13521,Crítica da estrutura da escola,9788524924255,Vitor Henrique Paro,"R$ 71,00","R$ 35,50"
11100,"Crítica da razão indolente, A - contra o de",pe9r7d8í8ci5o2 d4a9 0e7x3p8e8ri,n Bcoia ventura de Sousa Sa,"toRs$ 89,00","R$ 44,50"
12400,Cuiabá - centro da América do Sul,9788524917554,Pedro Carlos Nogueira,"elixR$ 41,00","R$ 20,50"
13386,Cultura da crise e seguridade social,9788524923203,Ana Elizabete Mota,"R$ 73,00","R$ 36,50"
10104,Cultura e democracia - o discurso compet,n9te7 8e8 o5u2t4r9a1s 1fa9l0a3s,Marilena Chaui,"R$ 77,00","R$ 38,50"
13875,Cultura visual - imagens na modernidade,9788524927034,Iara Lis Schiavinatto,"R$ 59,00","R$ 29,50"
11768,"Curitiba - aqui, muito pinhão",9788524912566,Márcia Széliga,"R$ 41,00","R$ 20,50"
12679,Currículo na contemporaneidade - incerte,a9s 7e8 d8e5s2a4f9io1s9176,Regina Leite Garcia,"R$ 78,00","R$ 39,00"
13066,Curso de Direito do Serviço Social - (Acom,a9n7h8a8 C5D24) 921735,Carlos Simões,"R$ 105,00","R$ 52,50"
13701,Curso de pedagogia - Avanços e limites ap,s9 a7s8 D85ir2e4tr9iz2e5s6 72,Umberto de Andrade Pi,"toR$ 63,00","R$ 31,50"
13949,Cursos de pedagogia: inovações na forma,ão97 d8e8 p5r2o4f9e2s7so4r7e8s,Selma Garrido Pimenta,"R$ 65,00","R$ 32,50"
13980,Customização Curricular no Ensino Médio,9788524927409,Roberto Rafael Dias da,"ilvaR$ 63,00","R$ 31,50"
12632,Da África e sobre a África - textos de lá e d,9c7á88524919039,Ninfa Parreiras,"R$ 76,00","R$ 38,00"
13209,Da autoridade pedagógica à amizade intel,c9tu7a8l8 u5m24a9 p2l2a0ta1f5o,m Jual io Groppa Aquino,"R$ 65,00","R$ 32,50"
13718,Da cabeça aos pés,9788524925979,Flávia Côrtes,"R$ 57,00","R$ 28,50"
13038,Da escuta de textos à leitura,9788524921704,Élie Bajard,"R$ 46,00","R$ 23,00"
11136,Da fala para a escrita - atividades de retex,u9a7liz8a8ç5ã2o4907715,Luiz Antônio Marcuschi,"R$ 46,00","R$ 23,00"
12942,Da relação com o saber às práticas educat,va9s788524920509,Bernard Charlot,"R$ 75,00","R$ 37,50"
13892,"Descoberta, A",9788524927140,Jonas Ribeiro,"R$ 41,00","R$ 20,50"
13034,Descobrindo a arqueologia - o que os mor,o9s 7p8o8d5e2m49 n2o1s6 c4o3n,aLru is Pezo Lanfranco,"R$ 71,00","R$ 35,50"
13679,Descortesia e cortesia - Expressão de cult,ra9s788524925689,Ana Lúcia Tinoco Cabral,"R$ 76,00","R$ 38,00"
12759,Desenvolvimentismo e construção de heg,m9o7n8i8a5 -2 c4r9e1s9ci8m2e4,t oA na Elizabete Mota,"R$ 69,00","R$ 34,50"
13270,Desenvolvimento de comunidade e partici,a9ç7ã8o8524923104,Maria Luiza de Souza,"R$ 72,00","R$ 36,00"
12254,"Desenvolvimento humano - história, conc",it9o7s8 e8 5p2o4lê9m16ic5a6s4,Maria Cristina Soares d,"GoRu$v 5e1a,00","R$ 25,50"
12698,Desenvolvimento humano? E eu com isso,9788524919435,Joubert José Lancha,"R$ 55,00","R$ 27,50"
12850,Destruição em massa - geopolítica da fom,9788524920288,José Paulo Netto,"R$ 76,00","R$ 38,00"
13422,Desvendando os segredos do texto,9788524923517,Ingedore G. Villaça Koc,"R$ 65,00","R$ 32,50"
13957,Deu limerique na casa do bicho,9788524927539,Alexandre de Castro Go,"eRs $ 45,00","R$ 22,50"
12841,"Dia em que minha avó envelheceu, O",9788524920257,Lúcia Fidalgo,"R$ 46,00","R$ 23,00"
14184,"Diabo na Corte, O",9788524927652,Frei Betto,"R$ 49,00","R$ 24,50"
12852,Didática,9788524916038,José Carlos Libâneo,"R$ 75,00","R$ 37,50"
13576,Didática da língua espanhola no ensino m,d9io788524924989,LIGIA PAULA COUTO,"R$ 63,00","R$ 31,50"
13616,Dimensão subjetiva do processo educacio,"a9l,7 A88524925061",Ana M. Bahia Bock,"R$ 73,00","R$ 36,50"
13645,Dimensão técnico-operativa no Serviço So,"ia9l7, 8A8 -5  2d4e9s2a5fi2o2s 1",Yolanda Guerra,"R$ 65,00","R$ 32,50"
13716,Dinossauros,9788524925917,Flávia Côrtes,"R$ 65,00","R$ 32,50"
12302,Dinossauros do Brasil,9788524915895,Luisa Massarani,"R$ 52,00","R$ 26,00"
13269,Direito ao ambiente como direito à vida -,e9s7a8fi8o5s 2p4a9r2a 3a0 e7d4u,aAçidãao  Maria Monteiro Sil,"a R$ 72,00","R$ 36,00"
12688,Direito social e a assistência social na soci,"d9a7d8e8 b5r2a4si9le1i9ra7,0 O1",Berenice Rojas Couto,"R$ 65,00","R$ 32,50"
13255,Direitos humanos e concepções contemp,râ9n7e8a8s524922923,Jefferson Lee de Souza,"uizR$ 76,00","R$ 38,00"
14237,Direitos Humanos na América Latina:,9786555550498,Soraya Barreto Januário,"R$ 81,00","R$ 40,50"
12988,"Direitos humanos, democracia e desenvol",im97e8n8to524921377,Boaventura de Sousa Sa,"toRs$ 52,00","R$ 26,00"
12889,"Direitos sociais e sua regulamentação, Os",c9o7le8t8â5n2e4a9 d2e0 5le4i7s,Luiz Antonio Miguel Fer,"eiRra$ 105,00","R$ 52,50"
13371,Diretor escolar - educador ou gerente?,9788524923166,Vitor Henrique Paro,"R$ 46,00","R$ 23,00"
13773,Discurso - Tessituras de linguagem e traba,h9o788524925801,Maria da Glória di Fanti,"R$ 68,00","R$ 34,00"
14238,Discursos transviados:,9786555550115,Rodrigo Borba,"R$ 62,00","R$ 31,00"
13119,"Discursos, identidades e letramentos - ab",rd9a7g8e8n5s2 d4e9 2a1n7á5lis9e,d Me aria Aparecida Resen,"e ORt$t o6n8i,00","R$ 34,00"
13367,Ditadura e Serviço Social - uma análise do,e9r7v8iç8o5 S2o4c9i2a3l n1o80 B,a Jsoisl é Paulo Netto,"R$ 81,00","R$ 40,50"
13771,Diversidade sexual e de gênero e o serviço,s9o7ci8a8l 5n2o4 s9o2c6io2j8u0rí,iGcouilherme Gomes Ferre,"raR$ 62,00","R$ 31,00"
13221,Docência no Ensino Superior,9788524922145,Léa das Graças Camarg,"s ARn$a s7t5a,s0io0u","R$ 37,50"
12903,"Doutrina de segurança nacional e o ""milag","e9 e7c8o8n5ô2m49ic2o0""3 56",Carlos Giannazi,"R$ 68,00","R$ 34,00"
14190,ECA e a Proteção Integral de Crianças e Ad,l9e7s8ce6n5t5e5s550047,Eunice Teresinha Fáver,"R$ 65,00","R$ 32,50"
12732,Economia política - uma introdução crítica,9788524919794,José Paulo Netto,"R$ 72,00","R$ 36,00"
12829,Ecopedagogia e cidadania planetária,9788524920080,Cruz Prado,"R$ 54,00","R$ 27,00"
13117,Educação ambiental - dialogando com Pau,o9 F7r8e8ir5e24921865,Carlos Frederico Bernar,"o LRo$u 6r3ei,r0o0","R$ 31,50"
13926,Educação Ambiental: questões de vida,9788524927294,Carlos Frederico Bernar,"o LRo$u 6r3ei,r0o0","R$ 31,50"
13237,Educação como exercício do poder - crític,a9o7 8se8n5s2o4 9c2o2m8u8m6,mVi tor Henrique Paro,"R$ 45,00","R$ 22,50"
12250,Educação continuada na era digital,9788524916366,Maria Helena Bettega,"R$ 46,00","R$ 23,00"
12747,Educação de jovens e adultos - prática pe,ag9ó7g8i8c5a2 e4 919886,Vera Capucho,"R$ 59,00","R$ 29,50"
12416,"Educação de jovens e adultos - teoria, prá",ic9a7 e8 8p5ro2p4o9s1t7a127,José Eustáquio Romão,"R$ 57,00","R$ 28,50"
13268,"Educação de jovens e adultos sujeitos, sab",r9e7s8 e8 5p2rá4t9ic2a3s081,José Rubens Lima Jardili,"oR$ 68,00","R$ 34,00"
12748,Educação do campo como direito humano,9788524919916,Angela Monteiro Pires,"R$ 61,00","R$ 30,50"
12238,Educação e a crise do capitalismo real,9788524916168,Gaudêncio Frigotto,"R$ 71,00","R$ 35,50"
11173,Educação e atualidade brasileira,9788524908279,Paulo Freire,"R$ 65,00","R$ 32,50"
13092,Educação e direitos humanos - percepçõe,s9o7b8r8e5 a2 e4s9c2o1la8 5ju8s,a Flávia Schilling,"R$ 63,00","R$ 31,50"
12756,Educação e poder - introdução à pedagogi,9d7o8 c8o5n2f4li9to18841,Moacir Gadotti,"R$ 63,00","R$ 31,50"
12539,Educação e supervisão - o trabalho coletiv,9n7a8 e8s5c2o4la918568,Nilda Alves,"R$ 52,00","R$ 26,00"
12602,"Educação escolar - políticas, estrutura e o",a9n7i8z8aç5ã2o4918605,João Ferreira de Oliveir,"R$ 95,00","R$ 47,50"
12450,Educação especial no Brasil - história e pol,ti9c7a8s 8p5ú2b4li9c1a7s097,Marcos J. S. Mazzotta,"R$ 68,00","R$ 34,00"
14178,Educação Infantil,9788524927560,Zilma de M. R. Oliveira,"R$ 73,00","R$ 36,50"
14233,Educação Infantil - políticas internacionais,p9a7ra8 6cr5i5a5n5ça5s0 2d8e3 0,a K 3a rina Alves Biasoli,"R$ 67,00","R$ 33,50"
12677,Educação Infantil do campo,9788524919473,Ana Paula Soares da Sil,"aR$ 73,00","R$ 36,50"
12005,Educação infantil no coração da cidade,9788524914317,Isabel de Oliveira e Silv,"R$ 73,00","R$ 36,50"
12753,Educação matemática - pesquisa em movi,9e7n8to8524919398,Marcelo de Carvalho Bo,"baR$ 78,00","R$ 39,00"
13423,Educação matemática nos anos iniciais do,En9s7i8n8o5 F2u4n9d2a2m84e8nt,Vl -a nessa Dias Moretti,"R$ 72,00","R$ 36,00"
12394,Educação não formal e cultura política,9788524917233,Maria da Gloria Gohn,"R$ 46,00","R$ 23,00"
13391,Educação não formal no campo das artes,9788524923418,Maria da Gloria Gohn,"R$ 46,00","R$ 23,00"
12447,Educação natural em Rousseau - das nece,si9d7a8d8e5s2 d4a9 c1r7ia3n5ç6a,e C laudio Almir Dalbosco,"R$ 65,00","R$ 32,50"
14202,Educação ou barbárie?,9786555550245,Bernard Charlot,"R$ 68,00","R$ 34,00"
13368,"Educação, convivência e ética - audácia e",sp97er8a8n5ç2a4!923340,Mario Sergio Cortella,"R$ 46,00","R$ 23,00"
13090,"Educação, escola e docência - novos temp","s9, 7n8o8v5a2s4 a9t2it1u9d2e6s",Mario Sergio Cortella,"R$ 46,00","R$ 23,00"
12571,Educação: um tesouro a descobrir,9788524918452,Jacques Delors,"R$ 71,00","R$ 35,50"
13552,Educar com a matemática - fundamentos,9788524924521,Manoel Oriosvaldo de,"ouRr$a 89,00","R$ 44,50"
14292,"Eles leem, mas não compreendem",9786555550252,Élie Bajard,"R$ 72,00","R$ 36,00"
12562,Em busca da Pirâmide de diamantes,9788524918711,Marconi Leal,"R$ 46,00","R$ 23,00"
13828,"Emergência da Escola, A",9788524926709,José G. Gondra,"R$ 73,00","R$ 36,50"
12588,Ensinar e aprender com pesquisa no ensin,9m7é8d8i5o24918933,Antônio Joaquim Severi,"o R$ 54,00","R$ 27,00"
12777,Ensinar e aprender no ensino superior - p,r 9u7m8a8 5e2p4is9te1m99o5l4o,i aA ndtao nio Teodoro,"R$ 51,00","R$ 25,50"
12739,Ensino das ciências como compromisso ci,n9tí7fi8c8o5 e2 4so9c1i9a8l 0- 0os,Anna Maria Pessoa de,"arvRa$lh 7o1,00","R$ 35,50"
12086,Ensino de Biologia - histórias e práticas e,d9if7e8r8e5n2te4s9 1e5sp3a0ç7o,Martha Marandino,"R$ 68,00","R$ 34,00"
13821,Ensino de Ciências - fundamentos e méto,o9s788524926358,Demétrio Delizoicov,"R$ 75,00","R$ 37,50"
11745,Ensino de Filosofia no ensino médio,9788524913266,Evandro Ghedin,"R$ 73,00","R$ 36,50"
13752,Ensino de história - fundamentos e métod,s9788524926150,Circe Maria Fernandes,"itteRn$c 9o2u,r0t0","R$ 46,00"
12099,Ensino de matemática na educação de ad,"lt9o7s8, 8O524915390",Newton Duarte,"R$ 46,00","R$ 23,00"
13979,Ensino de música para pessoas com o Tra,st9o7r8n8o5 d2o4 9E2sp73ec5t5r,dVoa léria Peres Asnis,"R$ 45,00","R$ 22,50"
12652,Ensino e correção na produção de textos,sc9o7l8a8re5s24918858,Lílian Maria Ghiuro Pas,"areRll$i  79,00","R$ 39,50"
13093,"Envelhecimento, saúde e trabalho no tem",o9 d7o8 8c5a2p4it9a2l 1919,Sálvea de Oliveira Cam,"eloR e$  P7a6i,v0a0","R$ 38,00"
14185,Escala de Avaliação de Ambientes de Educ,ç9ã7o8 I8n5f2an49ti2l 7(c3r9ia3n,aTsh elma Harms,"R$ 45,00","R$ 22,50"
