"",,LISTA DE LIVROS,
"",,"Festa Virtual do Livroda USP 2021",
TÍTULO,AUTOR (A),PREÇO CAPA,"PREÇO COMDESCONTO"
A CIDADANIA NA PERSPECTIVA DA VELHICE: DESAFIOS COTIDIANOS PARA VIVER CO,Ra DimIGuNnIdDaA SDilEva d`Alencar,"R$ 40,00","R$ 20,00"
A cidade em tela: Itabuna e Walter Moreira,Lurdes Bertol Rocha,"R$ 30,00","R$ 15,00"
A educação revisitada: a velhice na sala de aula,Raimunda Silva d ́Alencar,"R$ 30,00","R$ 15,00"
A ética da paixão,Maria Luiza Nora,"R$ 25,00","R$ 12,50"
A lei da Ficha Limpa,Carlos Valder do Nascimento,"R$ 25,00","R$ 12,50"
A MENINA DOS OLHOS DE OURO,Piligra,"R$ 40,00","R$ 20,00"
A odisséia de Jorge Amado,Piligra,"R$ 50,00","R$ 25,00"
A Orquídea Negra,Roberto Sidnei Macedo,"R$ 30,00","R$ 15,00"
A palavra e o tempo de Euclides Neto: um garimpeiro da identidade cultural grapiú,Raita Lírio de Oliveira,"R$ 30,00","R$ 15,00"
A produção do direito no Brasil,Paulo Cesar S. Bezzera,"R$ 40,00","R$ 20,00"
A região cacaueira da Bahia  ED. 2,Lurdes Bertol Rocha,"R$ 40,00","R$ 20,00"
A Representação Social na Construção da Velhice,Raimunda Silva d`Alencar,"R$ 40,00","R$ 20,00"
A restituição da contribuição previdenciária dos inativos,Carlos Valder do Nascimento,"R$ 25,00","R$ 12,50"
A terra do fruto maldito,Ramon de Freitas Ribeiro,"R$ 25,00","R$ 12,50"
A vida refletida,Antônio Lopes,"R$ 28,00","R$ 14,00"
Adequação do Sistema Tributário Nacional,Carlos Valder do Nascimento,"R$ 40,00","R$ 20,00"
AGLOMERAÇÃO ITABUNA ILHÉUS: REDE URBANA E INTERAÇÕES ESPACIAIS,Gilmar Alves Trindade,"R$ 40,00","R$ 20,00"
Água corrente,Clarencio Gomes Baracho,"R$ 25,00","R$ 12,50"
Alimentação: problemas e soluções - a dieta primitiva,Dalton Senise Portela,"R$ 25,00","R$ 12,50"
América América: amostragem da ficção hispano-americana atual - aproximações b,Dasoirleinirea sCerqueira,"R$ 25,00","R$ 12,50"
Antologia panorâmica do conto baiano - século XX,Gerana Damulakis (Org.),"R$ 35,00","R$ 17,50"
AS FORMIGAS PONEROMORFAS DO BRASIL,Jacques Delabie,"R$ 250,00","R$ 125,00"
Assassinos de aluguel e outros contos,Enio Jelihovschi,"R$ 20,00","R$ 10,00"
Até mais verde  ED. 2,Pawlo Cidade,"R$ 30,00","R$ 15,00"
"",,,
"Atos de currículo formação em ato? Para compreender, entretecer e problematizar",cRuorbríecrutlo  Sei dfonremi Maçaãcoedo,"R$ 30,00","R$ 15,00"
Auditoria em enfermagem: uma proposta metodológica,Ricardo M. Santana,"R$ 30,00","R$ 15,00"
Brincando com as palavras,Leônidas Azevedo Filho,"R$ 40,00","R$ 20,00"
CACAU: RIQUEZA DE POBRES,Francisco Mendes Costa,"R$ 30,00","R$ 15,00"
"CACAUICULTURA: ESTRUTURA PRODUTIVA, MERCADOS E PERSPECTIVAS",Mônica de Moura Pires (Org.),"R$ 35,00","R$ 17,50"
"Cadernos de aula de filosofia (Cadernos de aulas, n. 11)",Marisa Carneiro de Oliveira,"R$ 20,00","R$ 10,00"
Cancioneiro do Cacau   ED. 2,Cyro de Mattos,"R$ 25,00","R$ 12,50"
Cartografias contemporâneas: memória e cidade na ficção,Cláudio do Carmo (Org.),"R$ 25,00","R$ 12,50"
"Cavernas, rituais e religião",Luiz Eduardo P. Travassos,"R$ 40,00","R$ 20,00"
Com o mar entre os dedos,Antônio Lopes,"R$ 25,00","R$ 12,50"
Comunicação e cultura regional: conhecendo a mídia que nos (re)conhece (Cadern,"sA dneto anuiola sN, onl.b 9e)rto de O. Xavier","R$ 15,00","R$ 7,50"
Contos a contar/contos contados,Leônidas Azevedo Filho,"R$ 25,00","R$ 12,50"
Contos reunidos,Aramis Ribeiro Costa,"R$ 50,00","R$ 25,00"
Controle social na política de saúde,Meire Núbia de Santana,"R$ 35,00","R$ 17,50"
"Crimes, drogas e políticas",Paulo Cesar P. Fraga (Org.),"R$ 25,00","R$ 12,50"
Da pesquisa para a sociedade,Lisandro Diego G. Alvarez,"R$ 25,00","R$ 12,50"
Da porteira para fora: mundo de preto em terra de branco,Ruy do carmo Póvoas,"R$ 30,00","R$ 15,00"
De tabocas a Itabuna: um estudo histórico-geográfico ED. 2,Maria Palma Andrade,"R$ 45,00","R$ 22,50"
Diálogos e perspectivas na formação do profissional de História,Andréa Rocha Rodrigues (Org.),"R$ 20,00","R$ 10,00"
Direito Constitucional Penal,Carlos Valder do Nascimento,"R$ 25,00","R$ 12,50"
Direito público: questões polêmicas,Carlos Valder do Nascimento,"R$ 25,00","R$ 12,50"
Direito Tributário I,Carlos Valder do Nascimento,"R$ 25,00","R$ 12,50"
DIREITO TRIBUTÁRIO II,Carlos Valder do Nascimento,"R$ 25,00","R$ 12,50"
"DIREITO TRIBUTÁRIO III: AUTONOMIA, EVOLUÇÃO HISTÓRICA E RELAÇÕES COM OU",CRaArlSo Ds IVSaClIdPeLrI NdAoS Nascimento,"R$ 25,00","R$ 12,50"
"Direito Tributário IV: interpretação, obrigação e crédito tributário",Carlos Valder do Nascimento,"R$ 25,00","R$ 12,50"
DIREITO TRIBUTÁRIO V: GARANTIAS DO CRÉDITO TRIBUTÁRIO E ADM. TRIBUTÁRIA,Carlos Valder do Nascimento,"R$ 25,00","R$ 12,50"
Documentário e turismo cultural: um olhar sobre Jorge Amado,Renata Farias Smith Lima,"R$ 15,00","R$ 7,50"
"Educação, Saúde e Esporte: Novos Desafios à Educação Física",Gelcemar Oliveira Farias (org.),"R$ 35,00","R$ 17,50"
Ensaios históricos de Itabuna: o jequitibá da taboca,Janete Ruiz de macedo,"R$ 50,00","R$ 25,00"
Ensino superior em turismo e hotelaria: reflexões sobre a docência e a pesquisa de,Aulaelxidaandere Shigunov Neto (Org.),"R$ 30,00","R$ 15,00"
Esteja a gosto! Viajando pela costa do cacau em literatura e fotografia,Maria de Lourdes N. Simões (Or,"R$ 60,00","R$ 30,00"
Estudos econômicos: um olhar sobre o nosso mundo,Lessi Pinheiro,"R$ 28,00","R$ 14,00"
Estudos sobre o Direito Constitucional Contemporâneo,Ives Gandra da Silva Martins,"R$ 50,00","R$ 25,00"
Expressões culturais literatura e turismo,Maria de Lourdes N. Simões (Or,"R$ 25,00","R$ 12,50"
"Farinha, madeira e cabotagem: a Capitania de Ilhéus no antigo sistema colonial",Marcelo Henrique Dias,"R$ 40,00","R$ 20,00"
Fibras Vegetais para compósitos poliméricos,Celso Carlino Maria Fornari Junior,"R$ 30,00","R$ 15,00"
Fluxos contemporâneos: capital humano e acadêmico-cultural,Maria Luiza S. Santos,"R$ 30,00","R$ 15,00"
Graciliano Ramos e o desgosto de ser criatura  ED. 2,Jorge de Souza Araujo,"R$ 30,00","R$ 15,00"
História e memórias do Instituto Nossa Senhora da Piedade,Renée Albagli,"R$ 40,00","R$ 20,00"
"HISTÓRIA E PROVIDÊNCIA: BOSSUET, VICO E ROUSSEAU: TEXTOS E ESTUDOS",Edmilson menezes (Org.),"R$ 25,00","R$ 12,50"
Histórias dispersas de Adonias Filho,Cyro de Mattos (Org.),"R$ 45,00","R$ 22,50"
"Identidade cultural e expressões regionais: estudos sobre literatura, cultura e turis",Mo aria de Lourdes N. Simões (Or,"R$ 30,00","R$ 15,00"
IDENTIDADE PROFISSIONAL DOS SERVIDORES COMISSIONADOS DA UESC,Geysa da Rocha,"R$ 20,00","R$ 10,00"
"Identidade, território, utopia: literatura baiana contemporânea",Reheniglei Rehem (Org.),"R$ 30,00","R$ 15,00"
"In Memorian: urbanismo, literatura e morte",André Luiz Rosa Ribeiro,"R$ 35,00","R$ 17,50"
Infâncias-devir e currículo: a afirmação do direito das crianças à (aprendizagem) for,Raoçbãeorto Sidnei Macedo,"R$ 35,00","R$ 17,50"
Itinerários do conto: interfaces críticas e teóricas da modernidade short story,Hélio Pólvora,"R$ 20,00","R$ 10,00"
"José Dantas de Andrade, Dantinhas, Zé das Antas: Um olhar sobre o campo e a cida",Jeorge de Souza Araujo,"R$ 25,00","R$ 12,50"
LEA 10 anos de Brasil,Tatiany Pertel,"R$ 25,00","R$ 12,50"
"Leitura e produção textual (Cadernos de aulas, n. 10)",Gessilene S. Kanthack,"R$ 20,00","R$ 10,00"
"Literatura de cacau (Cadernos de aulas, n. 8)",Reheniglei Rehem (Org.),"R$ 25,00","R$ 12,50"
Literatura o cacau - Cyro de Matos: estudos literários,Reheniglei Rehem (Org.),"R$ 25,00","R$ 12,50"
Manoel Lins: o canto da eterna esperança,Antônio Lopes,"R$ 65,00","R$ 32,50"
Manual da produção vegetativa de mudas de cacaueiro,George Andrade Sodré,"R$ 20,00","R$ 10,00"
Maracujá: avanços tecnológicos e sustentabilidade,Mônica de Moura Pires (Org.),"R$ 25,00","R$ 12,50"
MEJIGÃ E O CONTEXTO DA ESCRAVIDÃO,Ruy do carmo Póvoas,"R$ 50,00","R$ 25,00"
Memória e identidade: reformas urbanas e arquitetura cemiterial na região cacauei,Aan (d1r8é8 0Lu-1iz9 5R0o)sa Ribeiro,"R$ 25,00","R$ 12,50"
Mídia alternativa: estratégias e desafios para a comunicação hegemônica,Ricardo O. Freitas (Org.),"R$ 30,00","R$ 15,00"
Minelvino Trovador Apóstolo,Jorge de Souza Araujo,"R$ 40,00","R$ 20,00"
Mosaico Econômico do Global ao Regional,Aline Conceição Souza,"R$ 30,00","R$ 15,00"
Mudança instituicional e reconversão produtiva no sul da Bahia,ELSON CEDRO,"R$ 40,00","R$ 20,00"
"",,"R$ 15,00","R$ 7,50"
"",,,
"Na beleza do lugar, o rio das contas indo...ao mar",Rita Jaqueline Nogueira Chiapetti,"R$ 40,00","R$ 20,00"
Nelson Schaun merece um livro ED. 2,Maria Schaun,"R$ 40,00","R$ 20,00"
Normas Técnicas Para Elaboração de Trabalhos Acadêmicos  ED. 2,Maria Aparecida Leão Bittencourt (org.),"R$ 15,00","R$ 7,50"
O congresso contra a soberania popular: a inconstitucionalidade de impeachment s,Cma rclorism Vea dldee re dsop oNnassacbimiliednatdoe,"R$ 25,00","R$ 12,50"
O livro-arbítrio das Evas,Neuzamaria Kerner,"R$ 25,00","R$ 12,50"
O mar na prosa brasileira de ficção,Aramis Ribeiro Costa,"R$ 10,00","R$ 5,00"
O outro: entre a cura e o cuidado,Evani Moreira P. dos Santos,"R$ 15,00","R$ 7,50"
O rato saliente: uma história de enrolar a língua,Leônidas Azevedo Filho,"R$ 25,00","R$ 12,50"
O supremo contra o direito: o caso da contribuição dos inativos,Carlos Valder do Nascimento,"R$ 25,00","R$ 12,50"
Oralidade e escrita em Platão,Franco Trabattoni,"R$ 25,00","R$ 12,50"
"Ordem Imperial e aldeamento indígena: camacãs, gueréns e pataxós do sul da Bahi",Ayalla Oliveira Silva,"R$ 40,00","R$ 20,00"
OS OLHOS DA LACRAIA - LINGUAGEM POÉTICA SEMIÓTICA,Jorge de Souza Araujo,"R$ 55,00","R$ 27,50"
Piaçava da Bahia (Attalea funifera Martius): do extrativismo à cultura agrícola,Carlos Alex L. Guimarães,"R$ 55,00","R$ 27,50"
Planejamento em enfermagem: aplicação do processo de enfermagem na prática a,Rmicinairsdtora Mtiv. aSantana,"R$ 30,00","R$ 15,00"
Plínio de Almeida - obra reunida,Flávio J. Simões Costa (Org.),"R$ 35,00","R$ 17,50"
Pluralidades: patrimônio cultural e viagem: relendo a literatura sul-baiana,Maria de L. Netto Simões,"R$ 45,00","R$ 22,50"
Política e planejamento em cultura e turismo,Marco Aurélio Avila (Org.),"R$ 20,00","R$ 10,00"
Políticas públicas e o agronegócio cacau,Fernando Rios do Nascimento,"R$ 25,00","R$ 12,50"
Por Uma Teoria de Coisas Julgada Inconstitucional ED. 2,Carlos Valder do Nascimento,"R$ 30,00","R$ 15,00"
Português como língua estrangeira na UESC: questões identitárias e culturais,Maria D`Ajuda A. Ribeiro,"R$ 30,00","R$ 15,00"
"Práticas educativas e interatividade em comunicação e educação , v.3",Eliana Nagamini,"R$ 40,00","R$ 20,00"
"Processos Educativos na interface comunicação e educação, v. 2",Eliana Nagamini,"R$ 40,00","R$ 20,00"
Produção e difusão de ciência na cibercultura: narrativas e múltiplos olhares,Cristiane Porto,"R$ 35,00","R$ 17,50"
Profecias morenas: discursos do eu e da pátria em Antonio Vieira  ED. 2,Jorge de Souza Araujo,"R$ 30,00","R$ 15,00"
Programe-se: uma proposta de experimentação transmídia,Tcharly Magalhães Briglia,"R$ 50,00","R$ 25,00"
"Questões teóricas e formação profissional em Comunicação e Educação, v. 1",Eliana Nagamini,"R$ 40,00","R$ 20,00"
"Relações de gênero, cuidado e trabalho docente na educação infantil",Eronilda Maria G. de Carvalho,"R$ 30,00","R$ 15,00"
REPRESENTAÇÕES DO ESCONDIDO: O REAL OCULTO E O DADO EVIDENTE,Ruy do carmo Póvoas,"R$ 60,00","R$ 30,00"
Representações e turismo: imagens e práticas socioculturais no espaço,Natanael Reis Bomfim (Org.),"R$ 40,00","R$ 20,00"
Retrós de espelhos: o romantismo brasileiro com lentes de aumento,Jorge de Souza Araujo,"R$ 70,00","R$ 35,00"
Temas atuais de direitos fundamentais,Paulo Cesar S. Bezzera,"R$ 40,00","R$ 20,00"
"Trajetória, permanências e transformações têmporo-espaciais da cidade de Camac",nC-lBarAic: ein Gteornfaçacelvse cso Sm. d ae c Orilsivee dia cacauicultura,"R$ 30,00","R$ 15,00"
Tribunal do Júri - de conformidade com a Lei 11.689 de 09/06/08 e com a ordem co,Mstaitruccoiso nBalndeira,"R$ 40,00","R$ 20,00"
Turismo: desafios e especificações para um turismo sustentável,Gustavo da Cruz (Org.),"R$ 40,00","R$ 20,00"
Um lugar na história: a capitania e comarca de Ilheús antes de cacau,Marcelo Henrique Dias (Org.),"R$ 35,00","R$ 17,50"
Uma dobra no tempo: um memorial (quase) acadêmico,Nelson De Luca Pretto,"R$ 30,00","R$ 15,00"
Uma volta para o futuro: em busca do tempo-espaço perdido nas lembranças,Maria Inez carvalho,"R$ 28,00","R$ 14,00"
Universidade Pública e Desenvolvimento Local,José Ricardo Rosa dos Santos,"R$ 15,00","R$ 7,50"
Vou lhe contar um caso,Leônidas Azevedo Filho,"R$ 25,00","R$ 12,50"
"Whatsapp e Educação: entre mensagens, imagens e sons",Cristiane Porto/Kaio Eduardo/Alexandre Chagas,"R$ 45,00","R$ 22,50"
