"",,,,,$ C/ 50%
TÍTULO,,AUTOR,SELO,$ CAPA,
"",,,,,DESCONTO
10 PASSOS PARA VOCÊ SE TORNAR SEU MESTRE,"TELLES, IZABEL",,ÁGORA,"38,60","19,30"
100 JOGOS PARA GRUPOS,"YOZO, RONALDO YUDI K.",,ÁGORA,"65,70","32,85"
4 PRINCIPAIS LIDERANÇAS DA SOCIEDADE E SUAS COMPET,"RESENDE, ENIO J.",,SUMMUS,"38,60","19,30"
A LOVE STORY... WITH A HAPPY ENDING,"GIKOVATE, FLÁVIO",,MG EDITORES,"55,60","27,80"
ABDIAS NASCIMENTO - RETRATOS DO BRASIL NEGRO,"ALMADA, SANDRA DE SOUZA",,SELO NEGRO,"31,90","15,95"
ABORDAGEM À FAMÍLIA NO CONTEXTO DO CONSELHO TUTELAR,"FORTUNATO, L.; PENSO, M. ; GANDOLFO, M.",,ÁGORA,"62,80","31,40"
ABORDAGENS GRUPAIS EM FONOAUDIOLOGIA,"BERBERIAN,SANTANA,MASSI,GUARIN",,PLEXUS,"71,60","35,80"
AÇÕES AFIRMATIVAS EM EDUCAÇÃO,"SILVA, M.APAREC.CIDINHA (ORG)",,SELO NEGRO,"87,80","43,90"
AÇÕES EDUCATIVAS,PUTTINI//LIMA (ORGS),,ÁGORA,"59,70","29,85"
ACUPUNTURA E MEDICINA INTEGRATIVA,"VIEIRA, MÁRIO SÉRGIO ROSSI",,MG EDITORES,"62,80","31,40"
"ADEUS, MARIDOS","ABBOT, DEBORAH/FARMER, ELLEN",,EDIÇÕES GLS,"81,80","40,90"
"ADIANTADO DA HORA, O","LINS DA SILVA, CARLOS EDUARDO",,SUMMUS,"57,10","28,55"
ADOLESCÊNCIA E TRABALHO,"FONSECA, JOÃO CÉSAR DE FREITAS",,SUMMUS,"48,20","24,10"
"AFETIVIDADE DO EDUCADOR, A","MARCHAND, MAX",,SUMMUS,"42,80","21,40"
AFETIVIDADE NA ESCOLA,"ARANTES, VALÉRIA AMORIM (ORG)",,SUMMUS,"78,90","39,45"
"ÁFRICA NA SALA DE AULA, A - ED. REVISTA","HERNANDEZ, LEILA LEITE",,SELO NEGRO,"134,30","67,15"
AFROCENTRICIDADE - SANKOFA 4,"NASCIMENTO, ELISA LARKIN",,SELO NEGRO,"108,80","54,40"
AFROCIDADANIZAÇÃO,"GUIMARÃES, REINALDO DA SILVA",,SELO NEGRO,"62,50","31,25"
AGÊNCIA DE PROPAGANDA E AS ENGRENAGENS DA HISTÓRIA,"MENNA BARRETO, ROBERTO",,SUMMUS,"39,80","19,90"
"AGENTE SOCIAL QUE TRANSFORMA, O","MARRA, MARLENE MAGNABOSCO",,ÁGORA,"64,20","32,10"
AINDA E SEMPRE PSICODRAMA - EDIÇÃO REVISTA,"PERAZZO, SÉRGIO",,ÁGORA,"53,10","26,55"
AJUDA-ME A CRESCER,"CASALE, FRANCO DEL",SUMMUS,"71,60","35,80"
ALEGRIA,"LOWEN, ALEXANDER",SUMMUS,"74,40","37,20"
ALÉM DA LÓGICA,"O'CONNOR, J./MCDERMONT, IAN",SUMMUS,"90,60","45,30"
ALÉM DO HEROI,"CHINEN, ALLAN B.",SUMMUS,"94,50","47,25"
ALFABETIZAÇÃO E LETRAMENTO,"ARANTES, VALÉRIA AMORIN (ORG.)",SUMMUS,"76,00","38,00"
ALFABETIZAÇÃO EM VALORES HUMANOS,"SIMON, DÂMARIS; MARTURANO, EDNA",SUMMUS,"68,80","34,40"
ALIMENTAÇÃO SAUDÁVEL NA INFÂNCIA,"LOBO, CLÁUDIA",MG EDITORES,"48,20","24,10"
ALONGAMENTO E POSTURA,"COSTA, CHRISTINA; LIGGIERI, VICTOR C",SUMMUS,"89,80","44,90"
ALONGUE-SE - EDIÇÃO COMEMORATIVA,"ANDERSON, BOB",SUMMUS,"109,80","54,90"
ALONGUE-SE NO TRABALHO,"ANDERSON, BOB",SUMMUS,"66,40","33,20"
AMAR UM ADOLESCENTE,"FORD, JUDY",ÁGORA,"57,10","28,55"
AMAR UMA CRIANCA,"FORD, JUDY",ÁGORA,"53,10","26,55"
AMOR CONJUGAL E TERAPIA DE CASAL,"DI YORIO, VANDA",SUMMUS,"48,20","24,10"
AMOR E ÉTICA,"BARROS, PAULO",SUMMUS,"100,90","50,45"
AMOR E ORGASMO,"LOWEN, ALEXANDER",SUMMUS,"99,30","49,65"
AMOR E PERDA,"PARKES, COLIN MURRAY",SUMMUS,"108,10","54,05"
AMOR E VINCULOS,"KELEMAN, STANLEY",SUMMUS,"62,80","31,40"
"AMOR NA RELACAO TERAPEUTICA, O","CARDELLA, BEATRIZ H PARANHOS",SUMMUS,"42,80","21,40"
"AMOR, CASAMENTO, FAMÍLIA, DIVÓRCIO E DEPOIS","SOUZA, ROSANE M./RAMIRES, VERA",SUMMUS,"78,90","39,45"
"AMOR, SEXO E SEU CORACAO","LOWEN, ALEXANDER",SUMMUS,"61,70","30,85"
AMORES PERFEITOS - EDIÇÃO REVISTA,"GAIARSA, JOSÉ ANGELO",ÁGORA,"71,60","35,80"
ANÁLISE PSICODRAMÁTICA,"DIAS, VICTOR ROBERTO C SILVA",ÁGORA,"62,80","31,40"
ANATOMIA DA NOITE,"EL-JAICK, MÁRCIO",EDIÇÕES GLS,"51,00","25,50"
ANATOMIA EMOCIONAL,"KELEMAN, STANLEY",SUMMUS,"131,70","65,85"
ANGEL VIANNA: A PEDAGOGA DO CORPO,"BENTO, MARIA ENAMAR R. NEHERER",SUMMUS,"57,10","28,55"
ANGÚSTIAS CONTEMPORÂNEAS E GESTALT-TERAPIA,"MARRAS, MARGARET (ORG.)",SUMMUS,"76,00","38,00"
"ANIMAIS E A PSIQUE, OS - VOL. 1",DIVERSOS AUTORES,SUMMUS,"94,50","47,25"
"ANIMAIS E A PSIQUE, OS - VOL. 2",DIVERSOS AUTORES,SUMMUS,"97,50","48,75"
APARTAMENTO 41,"CARVALHO, NELSON LUIZ DE",EDIÇÕES GLS,"53,10","26,55"
"APRENDER A ESCRITA, APRENDER COM A ESCRITA","GOULART, CECÍLIA; WILSON, VICTORIA",SUMMUS,"84,60","42,30"
APRENDER: VERBO TRANSITIVO,"LOMONACO, BEATRIZ PENTEADO",SUMMUS,"59,70","29,85"
APRENDIZAGEM BASEADA EM PROBLEMAS,"ARAÚJO,ULISSES;SASTRE,GENOVEVA",SUMMUS,"78,90","39,45"
APRENDIZAGEM DINAMICA VOL I,"DILTS,ROBERT/ EPSTEIN,TODD",SUMMUS,"67,90","33,95"
APRENDIZAGEM DINAMICA VOL II,"DILTS,ROBERT/ EPSTEIN TODD",SUMMUS,"84,60","42,30"
APRIMORANDO A SAUDE SEXUAL,INST. PAULISTA DE SEXUALIDADE,SUMMUS,"108,80","54,40"
APROXIMAÇÕES ENTRE JUNG E MORENO,"RAMALHO, CYBELE M. R.",ÁGORA,"59,70","29,85"
"ARTE DA PEREGRINAÇÃO, A","COUSINEAU, PHIL",ÁGORA,"87,80","43,90"
"ARTE DE RESTAURAR HISTÓRIAS, A","JULIANO, JEAN CLARK",SUMMUS,"57,10","28,55"
"ARTE DE TECER O PRESENTE, A","MEDINA, CREMILDA",SUMMUS,"57,10","28,55"
ARTE E GESTALT,"RHYNE, JANIE",SUMMUS,"94,50","47,25"
"ARTE, CLÍNICA E LOUCURA","LIMA, ELIZABETH ARAÚJO",SUMMUS,"81,80","40,90"
ARTES DO CORPO,"SILVA, VAGNER GONÇALVES DA(ORG",SELO NEGRO,"84,60","42,30"
ARTETERAPIA PARA FAMILIAS,"RILEY, SHIRLEY",SUMMUS,"92,10","46,05"
ASPECTOS BIOMECÂNICOS,"CAMPIGNION, PHILIPPE",SUMMUS,"106,40","53,20"
ASSESSORIA DE IMPRENSA - COMO FAZER,"CHINEM, RIVALDO",SUMMUS,"65,70","32,85"
ASSESSORIA DE IMPRENSA: TEORIA E PRÁTICA,"FERRARETTO, ELISA E LUIZ ARTUR",SUMMUS,"57,10","28,55"
ASSUSTANDO OS UNICORNIOS,"SCHIMEL, LAWRENCE",EDIÇÕES GLS,"51,00","25,50"
ASTROLOGIA PARA ASTRÓLOGOS E AMANTES DA ASTROLOGIA,ASSURAMAYA,ÁGORA,"94,50","47,25"
ASTROLOGIA PARA GAYS E LESBICAS,"LOBO, ESTELA ROTTA",EDIÇÕES GLS,"65,70","32,85"
ATIVIDADE VERBAL,"MACKAY,ANA PAULA M. G.",PLEXUS,"59,70","29,85"
"ATLETA DOS ATLETAS, O","LEONARD, GEORGE",SUMMUS,"81,80","40,90"
ATOS RETÓRICOS,"HALLIDAY, TEREZA LUCIA (ORG.)",SUMMUS,"51,00","25,50"
ATRÁS DAS CÂMERAS,"LEAL FILHO, LAURINDO LALO",SUMMUS,"42,80","21,40"
ATRAVESSAGEM,"MEDINA, CREMILDA",SUMMUS,"76,70","38,35"
ATRAVESSANDO,BANDLER/GRINDER,SUMMUS,"96,50","48,25"
AUTOCONHECIMENTO NA FORMAÇÃO DO EDUCADOR,"ESPÍRITO SANTO, RUY CÉZAR DO",ÁGORA,"42,80","21,40"
AUTO-ESTIMA PARA HOMOSSEXUAIS,"HARDIN, KIMERON N.",EDIÇÕES GLS,"81,80","40,90"
AUTOGESTÃO NA SALA DE AULA,"ARAÚJO, ULISSES FERREIRA",SUMMUS,"42,80","21,40"
AUTOPOSTURAS DA RPG,"SOUCHARD, PHILIPPE",SUMMUS,"50,70","25,35"
AUTORIDADE E AUTONOMIA NA ESCOLA,"AQUINO, JULIO GROPPA",SUMMUS,"76,00","38,00"
"AVENTURA DA AUTODESCOBERTA, A","GROF, STANISLAV",SUMMUS,"94,50","47,25"
"AVENTURAS DE UM GAROTO DE PROGRAMA, AS","ANDROS, PHIL",EDIÇÕES GLS,"62,80","31,40"
AVÓS E SOGRAS,"MONTEIRO, ELIZABETH",SUMMUS,"47,10","23,55"
BABÁ / MÃE - MANUAL DE INSTRUÇÕES,"PALERMO, ROBERTA",MESCLA,"57,10","28,55"
BALADA PARA AS MENINAS PERDIDAS,"LEONEL, VANGE",EDIÇÕES GLS,"59,70","29,85"
"BASES DA FISIOLOGIA DA TERAPIA MANUAL, AS","BIENFAIT, MARCEL",SUMMUS,"106,40","53,20"
BASES ELEMENTARES - TÉCNICAS DE TERAPIA MANUAL E OSTEOPATIA,"BIENFAIT, MARCEL",SUMMUS,"93,10","46,55"
"BEBE E A COORDENACAO MOTORA, O","BEZIERS, MARIE-MADEL/HUNSINGER",SUMMUS,"63,80","31,90"
"BELEZA IMPOSSÍVEL, A","MORENO, RACHEL",ÁGORA,"42,80","21,40"
BIOENERGÉTICA - EDIÇÃO REVISTA,"LOWEN, ALEXANDER",SUMMUS,"84,60","42,30"
"BIOMECÂNICA DA COORDENAÇÃO MOTORA, A","SANTOS, ANGELA",SUMMUS,"98,30","49,15"
"BIOPODER, TOTALITARISMO Y LA CLÍNICA DEL SUFRIMIENTO","GRANZOTTO, MARCOS; GRANZOTTO, ROSANE L.",SUMMUS,"65,70","32,85"
"BOLA E O VERBO, A","VIANA, RODRIGO SILVA",SUMMUS,"42,80","21,40"
"BOLA NO AR, A","SOARES, EDILEUSA",SUMMUS,"48,20","24,10"
"BRASIL PODE SER UM PAÍS DE LEITORES?, O","LINDOSO, FELIPE",SUMMUS,"48,30","24,15"
BRIGANDO PELA VIDA,"LESHAN, LAWRENCE",SUMMUS,"51,00","25,50"
BRUXAS E HEROIS,"YOUNG-EISENDRATH, POLLY",SUMMUS,"64,20","32,10"
"BRUXAS QUE VIVEM DENTRO DE NOS, AS","GARROUX, BABY",ÁGORA,"71,60","35,80"
"BUSCA DA ELEGÂNCIA EM PSICOTERAPIA, A","ZINKER, JOSEPH",SUMMUS,"102,40","51,20"
CADÊ O PAI DESSA CRIANÇA?,"MONTEIRO, ELIZABETH",SUMMUS,"51,00","25,50"
CADEIAS ÂNTERO-LATERAIS,"CAMPIGNION, PHILIPPE",SUMMUS,"117,00","58,50"
CADEIAS ANTEROMEDIANAS,"CAMPIGNION, PHILIPPE",SUMMUS,"129,00","64,50"
CADEIAS MUSCULARES E ARTICULARES,"DENYS-STRUYF, GODELIEVE",SUMMUS,"79,80","39,90"
CADEIAS POSTEROANTERIORES E ANTEROPOSTERIORES,"CAMPIGNION, PHILIPPE",SUMMUS,"153,20","76,60"
CADEIAS POSTEROLATERAIS,"CAMPIGNION, PHILIPPE",SUMMUS,"106,40","53,20"
CADEIAS POSTEROMEDIANAS,"CAMPIGNION, PHILIPPE",SUMMUS,"129,00","64,50"
CALL CENTER,"MANCINI, LUCAS",SUMMUS,"60,40","30,20"
CAMINHANDO SOBRE FRONTEIRAS,"FROCHTENGARTEN, FERNANDO",SUMMUS,"59,70","29,85"
CAMINHO ANCESTRAL,"PANOZZO, GIOIA",ÁGORA,"48,20","24,10"
"CAMINHO DA CABALA, O","HALEVI, Z'EV BEN SHIMON",ÁGORA,"94,50","47,25"
"CAMINHO DA REALIZAÇÃO COM A AGRICULTURA CELESTE, O","BERNIS, MAURÍCIO",ÁGORA,"48,20","24,10"
"CAMINHO DAS PEDRAS, O","INOUE, RYOKI",SUMMUS,"48,20","24,10"
"CAMINHO QUÁDRUPLO, O","ARRIEN, ANGELES",ÁGORA,"79,80","39,90"
CAMINHOS DA ALMA,"SILVA, VAGNER GONÇALVES",SELO NEGRO,"90,60","45,30"
CAMINHOS DA MUSICOTERAPIA,"RUUD, EVEN",SUMMUS,"42,80","21,40"
CAMINHOS PARA A SAÚDE AUDITIVA,"MORATA,THAIS C./ZUCKI,FERNANDA",PLEXUS,"74,50","37,25"
"CAMPEÃO DE AUDIÊNCIA, O","PRIOLLI, GABRIEL; CLARK, WALTER",SUMMUS,"60,40","30,20"
"CANCER COMO PONTO DE MUTAÇÃO, O","LESHAN, LAWRENCE",SUMMUS,"67,90","33,95"
CÂNCER E PREVENÇÃO,"MALZYNER, ARTUR; CAPONERO, RICARDO",MG EDITORES,"48,20","24,10"
CANDOMBLÉ E UMBANDA,"SILVA, VAGNER GONÇALVES DA",SELO NEGRO,"46,40","23,20"
CAPITAL SOCIAL E COMUNICAÇÃO,"MATOS, HELOIZA",SUMMUS,"92,10","46,05"
CAPOEIRA,"VIDOR, ELISABETH; REIS, LETÍCIA V. S.",SELO NEGRO,"42,80","21,40"
CARACTEROLOGIA PÓS-REICHIANA,"NAVARRO, FEDERICO",SUMMUS,"42,80","21,40"
"CARMA DO AGORA, O","SCHULMAN, MARTIN",ÁGORA,"42,80","21,40"
CARNE DE SOJA,"OLKOVSKI, IRENE",MG EDITORES,"42,80","21,40"
CARTAS DE UM SOBREVIVENTE,"SIMONTON, O CARL/HENSON,M REID",SUMMUS,"67,90","33,95"
"CARTILHA DA NOVA MÃE, A","GAIARSA, JOSÉ ANGELO",ÁGORA,"42,80","21,40"
"CASAL EM CRISE, O",ANDOLFI/ANGELO/SACCU,SUMMUS,"71,60","35,80"
CATÁLOGOS,DIVERSOS,ÁGORA,"0,00","0,00"
CENAS FAMILIARES,"REIS, JOSÉ ROBERTO TOZONI",ÁGORA,"51,00","25,50"
"CENAS TEMIDAS DO PSICOTERAPEUTA INICIANTE, AS","PEREIRA, RUBENS ANTONIO",ÁGORA,"51,00","25,50"
CENTRO DE CULTURA E ARTE NEGRA - CECAN,"SILVA, JOANA MARIA FERREIRA DA",SELO NEGRO,"31,90","15,95"
"CEREBRO ESQUERDO, CEREBRO DIREITO","SPRINGER, SALLY /DEUTSCH GEORG",SUMMUS,"115,60","57,80"
CÉU DA BOCA,"ELEK, EDITH (ORG)",ÁGORA,"48,20","24,10"
CH'AN TAO - ESSENCIA DA MEDITACAO,JIA/ LEITE/ TAKEDA,PLEXUS,"65,10","32,55"
CICATRIZES E TATUAGENS,"ALFACE, FELIPE DE SOUZA",EDIÇÕES GLS,"48,20","24,10"
"CICLO DO CONTATO, O - 8a EDIÇÃO","RIBEIRO, JORGE PONCIANO",SUMMUS,"68,80","34,40"
CIDADANIA,"RESENDE, ENIO J",SUMMUS,"42,80","21,40"
"CIDADANIA, SURDEZ E LINGUAGEM","SILVA,I./GESUELI,Z./KAUCHAKJE",PLEXUS,"81,80","40,90"
CIDADAO CORPO,"BERTAZZO, IVALDO",SUMMUS,"72,50","36,25"
CIÊNCIA E JORNALISMO,"MEDINA, CREMILDA",SUMMUS,"48,20","24,10"
CIGARRO: UM ADEUS POSSÍVEL - ED. REVISTA,"GIKOVATE, FLÁVIO",MG EDITORES,"68,80","34,40"
"CINCO C'S DA CINEMATOGRAFIA, OS",JOSEPH V. MASCELLI,SUMMUS,"133,00","66,50"
"CINCO ELEMENTOS NA ALIMENTAÇÃO EQUILIBRADA, OS","FAHRNOW, I.M./FAHRNOW, J.",ÁGORA,"133,00","66,50"
CINE ARCO-ÍRIS,"LEKITSCH, STEVAN FRANCIS",EDIÇÕES GLS,"94,50","47,25"
CINEMA BRASILEIRO A PARTIR DA RETOMADA,"IKEDA, MARCELO",SUMMUS,"75,70","37,85"
CINEMA BRASILEIRO NO SÉCULO 21,"BALLERINI, FRANTHIESCO",SUMMUS,"101,10","50,55"
CINEMA COMO PRATICA SOCIAL,"TURNER, GRAEME",SUMMUS,"62,80","31,40"
CÍRCULOS DE MULHERES,"DEL PICCHIA, BEATRIZ; BALIEIRO, CRISTINA",ÁGORA,"96,70","48,35"
CIRURGIA BARIÁTRICA E PARA O DIABETES,"GIANSANTE, MARCOS",MG EDITORES,"53,10","26,55"
CIÚME - O LADO AMARGO DO AMOR,"FERREIRA-SANTOS, EDUARDO",ÁGORA,"42,80","21,40"
"CLÍNICA FONOAUDIOLÓGICA E A PSICOLOGIA CLÍNICA, A","ANCONA-LOPES, LILIA",PLEXUS,"59,70","29,85"
"CLÍNICA FONOAUDIOLÓGICA EM QUESTÃO, A","PASSOS, MARIA CONSUÊLO(ORG)",PLEXUS,"59,70","29,85"
"CLÍNICA GESTÁLTICA COM ADOLESCENTES, A","ZANELLA, ROSANA (ORG.)",SUMMUS,"64,20","32,10"
"CLÍNICA GESTÁLTICA COM CRIANÇAS, A","ANTONY, SHEILA (ORG.)",SUMMUS,"68,80","34,40"
"CLÍNICA, A RELAÇÃO PSICOTERAPÊUTICA E O MANEJO EM GESTALT-TERAPIA,A","FRAZÃO, LILIAN; FUKUMITSU, KARINA (ORGS.)",SUMMUS,"64,20","32,10"
CLÍNICAS GESTÁLTICAS,"GRANZOTTO, MARCOS; GRANZOTTO, ROSANE L.",SUMMUS,"98,00","49,00"
CODEPENDÊNCIA:O TRANSTORNO E A INTERVENÇÃO EM REDE,"ZAMPIERI, MARIA APARECIDA",ÁGORA,"94,50","47,25"
COLEÇÃO 4X COMPETÊNCIA,"RESENDE, ENIO J.",SUMMUS,"153,90","76,95"
COM A VIDA DE NOVO,SIMONTON/CREIGHTON,SUMMUS,"78,90","39,45"
COM CREDIBILIDADE NÃO SE BRINCA!,"LUCAS, LUCIANE (ORG)",SUMMUS,"76,00","38,00"
COMIDA DE CRIANÇA,"SILVA, CLAUDIA P LOBO E",MG EDITORES,"102,40","51,20"
COMO AGARRAR UM MARIDO - VERSAO GAY,"PRICE, PATRICK",EDIÇÕES GLS,"64,20","32,10"
COMO BRINCAM AS CRIANÇAS SURDAS,"SILVA, DANIELE NUNES HENRIQUE",PLEXUS,"48,20","24,10"
COMO EDUCAR SEM USAR A VIOLÊNCIA,"LORCH, DORA",SUMMUS,"59,70","29,85"
COMO EU COMO?,"GONSALVES, PAULO EIRÓ",MG EDITORES,"51,00","25,50"
COMO FALAR NO RÁDIO,"CÉSAR, CYRO",SUMMUS,"96,50","48,25"
COMO FALAR PARA O ALUNO APRENDER,"FABER, ADELE/MAZLISH ELAINE",SUMMUS,"81,80","40,90"
"COMO FALAR PARA SEU FILHO OUVIR E COMO OUVIR PARA SEU FILHOFALAR","FABER, A./MAZLISH, E.",SUMMUS,"99,30","49,65"
COMO FAZER DOCUMENTÁRIOS,"LUCENA, LUIZ CARLOS PEREIRA",SUMMUS,"48,20","24,10"
COMO NASCEM OS PAIS,"KAUFMANN, RENATO",MESCLA,"65,10","32,55"
COMPETÊNCIA PEDAGÓGICA DO PROFESSOR UNIVERSITÁRIO - ED. REVISTA,"MASETTO, MARCOS TARCISO",SUMMUS,"68,80","34,40"
"COMPETÊNCIA, SUCESSO, FELICIDADE","RESENDE, ENIO J.",SUMMUS,"47,10","23,55"
COMPREENDENDO AS DOENÇAS,"BALL, JOHN",ÁGORA,"96,50","48,25"
COMPREENDENDO O SEU CHA,"RESENDE, ENIO J.",SUMMUS,"58,00","29,00"
"COMPREENSÃO DA PESSOA, A","CHAVES, JOSÉ",ÁGORA,"64,20","32,10"
COMUNICAÇÃO DE MASSA SEM MASSA,"CAPARELLI, SÉRGIO",SUMMUS,"48,20","24,10"
COMUNICAÇÃO DIRIGIDA ESCRITA NA EMPRESA- ED. AMPLI,"CESCA, CLEUZA GIMENES",SUMMUS,"94,50","47,25"
COMUNICAÇÃO E POLÍTICA,"DE MATOS, HELOIZA H; MARQUES, CRISTINA S",SUMMUS,"120,90","60,45"
"COMUNICAÇÃO MÉDICO-PACIENTE NO TRATAMENTO ONCOLÓGICO, A","CAPONERO, RICARDO",MG EDITORES,"64,20","32,10"
"COMUNICAÇÃO NÃO-VERBAL, A","DAVIS, FLORA",SUMMUS,"67,90","33,95"
COMUNICAÇÃO NÃO-VIOLENTA - 4a EDIÇÃO,"ROSENBERG, MARSHAL B.",ÁGORA,"94,50","47,25"
COMUNICAÇÃO NAS ORGANIZAÇÕES,"TORQUATO, GAUDÊNCIO",SUMMUS,"93,10","46,55"
COMUNICAÇÃO ORGANIZACIONAL ESTRATÉGICA,"KUNSCH, MARGARIDA MARIA KROHLING",SUMMUS,"120,90","60,45"
CONCEITO DE MUNDO E DE PESSOA EM GESTALT-TERAPIA,"RIBEIRO, JORGE PONCIANO",SUMMUS,"48,20","24,10"
"CONFINAMENTO CULTURAL, INFÂNCIA/LEITURA","PERROTTI, EDMIR",SUMMUS,"42,80","21,40"
CONHECENDO MELHOR A DOENCA DE PARKINSON,"LIMONJI, JOAO CARLOS PAPATERRA",PLEXUS,"59,70","29,85"
CONSCIÊNCIA PELO MOVIMENTO,"FELDENKRAIS, MOSHE",SUMMUS,"74,50","37,25"
"CONSTRUÇÃO DE SENTIDOS NA ESCR.DO ALUNO SURDO, A","SILVA, MARILIA DA P. MARINHO",PLEXUS,"42,80","21,40"
"CONSTRUCAO DO HOMEM SEGUNDO PIAGET, A","LIMA, LAURO DE OLIVEIRA",SUMMUS,"53,10","26,55"
"CONSTRUÇÃO DO PSICOTERAPEUTA, A","CARDELLA, BEATRIZ H. PARANHOS",SUMMUS,"78,90","39,45"
CONSUMIDOR X PROPAGANDA - ED. REVISTA E ATUALIZADA,"GIACOMINI FILHO, GINO",SUMMUS,"84,60","42,30"
"CONTATO, VÍNCULO, SEPARAÇÃO","HORTELANO, XAVIER SERRANO",SUMMUS,"42,80","21,40"
CONTROLE A DOR ANTES QUE ELA ASSUMA O CONTROLE,"CAUDILL, MARGARET A.",SUMMUS,"98,30","49,15"
CONVERSANDO SOBRE O LUTO,"GORETT, EDIRRAH; MAUTONI, MARIA APARECID",ÁGORA,"42,80","21,40"
CONVERSAS COM GERDA ALEXANDER,"HEMSY DE GAINZA, VIOLETA",SUMMUS,"62,80","31,40"
CONVERSAS CRIATIVAS E ABUSO SEXUAL,"MARRA, MARLENE MAGNABOSCO",ÁGORA,"46,40","23,20"
CONVIVER COM QUEM BEBE,"WILSON, MARY",SUMMUS,"48,20","24,10"
"COORDENACAO MOTORA, A",BEZIERS & PIRET,SUMMUS,"86,40","43,20"
CORAÇÃO: MANUAL DO PROPRIETÁRIO,"WAJNGARTEN, MAURÍCIO",MG EDITORES,"51,00","25,50"
"CORAGEM DE CRESCER, A","AZEVEDO, MARIA DE MELO",ÁGORA,"65,70","32,85"
CORAGEM DE SER,"PARANHOS, FÁBIO; MORIS, VERA",EDIÇÕES GLS,"51,00","25,50"
"CORPO DIZ SUA MENTE, O","KELEMAN, STANLEY",SUMMUS,"51,00","25,50"
CORPO E AYURVEDA,"MARINO, MARIA I.; DAMBRY, WALKYRIA G.",SUMMUS,"76,70","38,35"
"CORPO EM DEPRESSÃO, O","LOWEN, ALEXANDER",SUMMUS,"74,50","37,25"
"CORPO EM TERAPIA, O","LOWEN, ALEXANDER",SUMMUS,"107,80","53,90"
"CORPO NO LIMITE DA COMUNICAÇÃO, O","KIGNEL, RUBENS",SUMMUS,"51,00","25,50"
"CORPO NO TRABALHO DE PARTO, O","BIO, ELIANE",SUMMUS,"53,10","26,55"
"CORPO PILATES, O","SILLER, BROOKE",SUMMUS,"91,70","45,85"
"CORPO REFLETE O SEU DRAMA, O","FREIRE, CHRISTINA A.",ÁGORA,"48,20","24,10"
"CORPO REVELA, O",KURTZ/PRESTERA,SUMMUS,"59,70","29,85"
CORPO SOFRIDO E MAL-AMADO,"PENNA, LUCY",SUMMUS,"84,60","42,30"
"CORPO TRAÍDO, O - EDIÇÃO REVISTA","LOWEN, ALEXANDER",SUMMUS,"87,80","43,90"
"CORPO, ATIVIDADES CRIADORAS E LETRAMENTO","DANIELE, TEIXEIRA,MARINA, FAISSAL,FLÁVIA",SUMMUS,"42,80","21,40"
CORPORIFICANDO A EXPERIENCIA,"KELEMAN, STANLEY",SUMMUS,"63,80","31,90"
CORRENTES DA VIDA,"BOADELLA, DAVID",SUMMUS,"67,90","33,95"
"COTIDIANO NAS ENTRELINHAS, O","MAUTNER, ANNA VERONICA",ÁGORA,"48,20","24,10"
COURAÇA MUSCULAR DO CARÁTER (WILHELM REICH) - EDIÇÃO REVISTA,"GAIARSA, JOSÉ ANGELO",ÁGORA,"99,30","49,65"
CRENÇAS - CAMINHOS PARA A SAÚDE E O BEM-ESTAR,"DILTS, ROBERT",SUMMUS,"65,70","32,85"
CRIAÇÃO DE CURTA-METRAGEM EM VÍDEO DIGITAL,"MOLETTA, ALEX",SUMMUS,"58,40","29,20"
"CRIANÇA ATÉ 4 ANOS, A","SALEK, VÂNIA DE ALMEIDA",SUMMUS,"51,00","25,50"
"CRIANÇA E O MARKETING, A","SILVA, ANA M. D.; VASCONCELOS, LUCIENE R",SUMMUS,"42,80","21,40"
"CRIANÇA SURDA, A","GOLDFELD, MARCIA",PLEXUS,"62,80","31,40"
CRIANCAS VITIMAS DE ABUSO SEXUAL,"GABEL, MARCELINE (ORG.)",SUMMUS,"84,60","42,30"
CRIANDO ADOLESCENTES EM TEMPOS DIFÍCEIS,"MONTEIRO, ELIZABETH",SUMMUS,"62,80","31,40"
CRIANDO FILHOS EM TEMPOS DIFÍCEIS,"MONTEIRO, ELIZABETH",SUMMUS,"62,80","31,40"
CRIATIVIDADE EM PROPAGANDA,"BARRETO, ROBERTO MENNA",SUMMUS,"95,50","47,75"
CRIATIVIDADE NO TRABALHO E NA VIDA - ED.REVISTA,"BARRETO, ROBERTO MENNA",SUMMUS,"120,90","60,45"
CRÔNICAS E CONVERSAS PSICODRAMÁTICAS,"ROMAÑA, MARIA ALICIA",ÁGORA,"42,80","21,40"
CRUZ E SOUSA - RETRATOS DO BRASIL NEGRO,"PRANDINI, PAOLA DINIZ",SELO NEGRO,"31,90","15,95"
CUIDADO PATERNO E ENFRENTAMENTO DA VIOLÊNCIA,"PIMENTEL, ADELMA DO SOCORRO",SUMMUS,"42,80","21,40"
CUIDADO VIGILANTE,"MARRA, MARLENE MAGNABOSCO",ÁGORA,"39,90","19,95"
CUIDADOS PALIATIVOS,"CORADAZZI,ANA; CAPONERO,RICARDO E OUTRA",MG EDITORES,"86,80","43,40"
"CULPA É DA MÃE, A","MONTEIRO, ELIZABETH",SUMMUS,"92,10","46,05"
CULTURA EM MOVIMENTO - SANKOFA 2,"NASCIMENTO, ELISA LARKIN (ORG)",SELO NEGRO,"96,50","48,25"
"CURADOR INTERNO, O","PANOZZO, GIOIA",ÁGORA,"53,10","26,55"
CURAR PARA A IMORTALIDADE,"EPSTEIN, GERALD",ÁGORA,"90,60","45,30"
"DA CRIAÇÃO AO ROTEIRO - EDIÇÃO REVISTA, ATUAL. E AMPLIADA","COMPARATO, DOC",SUMMUS,"141,90","70,95"
DA EDUCAÇÃO DO CORPO AO EQUILÍBRIO DO ESPÍRITO,"EHRENFRIED, L",SUMMUS,"42,80","21,40"
DA ESCOLA PARA O MERCADO DE TRABALHO,"POLLAK, LINDSEY",SUMMUS,"98,30","49,15"
DA GRAVIDEZ AOS CUIDADOS COM O BEBÊ,"MEHOUDAR, ANNA",SUMMUS,"53,10","26,55"
DA PRA SER FELIZ... APESAR DO MEDO,"GIKOVATE, FLAVIO",MG EDITORES,"72,50","36,25"
DA REALIDADE A ACAO,"D'AMBROSIO, UBIRATAN",SUMMUS,"48,20","24,10"
DA SEDUÇÃO NA RELAÇÃO PEDAGÓGICA,"MORGADO, MARIA APARECIDA",SUMMUS,"51,00","25,50"
DA VIDA DOS PÁSSAROS,"RIBONDI, ALEXANDRE",EDIÇÕES GLS,"64,20","32,10"
DANÇA E EDUCAÇÃO,"ALMEIDA, FERNANDA DE SOUZA",SUMMUS,"48,20","24,10"
"DANÇA, A","VIANNA, KLAUSS",SUMMUS,"57,10","28,55"
"DANCA, EXPERIENCIA DE VIDA","FUX, MARIA",SUMMUS,"51,00","25,50"
DANÇAS EM TERAPIA OCUPACIONAL,"LIBERMAN, FLAVIA",SUMMUS,"48,20","24,10"
DANÇATERAPIA,"FUX, MARIA",SUMMUS,"42,80","21,40"
DANCE E RECRIE O MUNDO,"PENNA, LUCY",SUMMUS,"59,70","29,85"
DAR À LUZ... RENASCER,"RODRIGUES, LÍVIA PENNA F.",ÁGORA,"42,80","21,40"
DAS AMÉLIAS ÀS MULHERES MULTIFUNCIONAIS,"FUJISAWA, MARIE SUZUKI",SUMMUS,"59,70","29,85"
DE CORPO E ALMA,"FREIRE, JOAO BATISTA",SUMMUS,"57,10","28,55"
DE DOCENTE PARA DOCENTE,"COELI, REGINA/FERREIRA, WINDYZ",SUMMUS,"54,30","27,15"
DE OLHO NA POSTURA,"COSTA, CHRISTINA; LIGGIERI, VICTOR C",SUMMUS,"72,50","36,25"
DE PESSOA A PESSOA,"HYCNER, RICHARD H",SUMMUS,"62,80","31,40"
DE VOLTA AO QUINTAL MÁGICO,"BUITONI, DULCÍLIA",ÁGORA,"92,10","46,05"
DEFESAS DO EGO - ED. REVISTA E ATUALIZADA,"ALMEIDA, WILSON CASTELLO DE",ÁGORA,"48,20","24,10"
DEGLUTA,"DO AMARAL, PATRÍCIA MATTOS T.",PLEXUS,"57,10","28,55"
DEIXAR DE FUMAR FICOU MAIS FÁCIL (ED. REVISTA),"ISSA, JAQUELINE SCHOLZ",MG EDITORES,"42,80","21,40"
DEIXAR DE SER GORDO - ED. REVISTA E AMPLIADA,"GIKOVATE, FLAVIO",MG EDITORES,"51,00","25,50"
DELICADAS COREOGRAFIAS,"LIBERMAN, FLÁVIA",SUMMUS,"133,00","66,50"
DEPOIS DA QUEDA...DANÇATERAPIA,"FUX, MARÍA",SUMMUS,"42,80","21,40"
DEPOIS DA VIDA - 2a EDIÇÃO,"MILLER, SUKIE",SUMMUS,"74,50","37,25"
DESAFIOS DO CORPO PILATES,"SILER, BROOKE",SUMMUS,"108,80","54,40"
DESAFIOS NA FORMAÇÃO DO EDUCADOR,"SANTO, RUY CÉZAR DO ESPÍRITO",ÁGORA,"51,00","25,50"
"DESCANSEM EM PAZ OS NOSSOS MORTOS DENTRO DE MIM - EDIÇÃOREVISTA","PERAZZO, SÉRGIO",ÁGORA,"57,10","28,55"
DESCOBRINDO CRIANCAS,"OAKLANDER, VIOLET",SUMMUS,"111,20","55,60"
DESCOBRINDO O PRAZER - ED AMPLIADA,HEIMAN/LOPICOLO,SUMMUS,"90,60","45,30"
"DESENVOLVIMENTO DO RACIOCÍNIO NA ERA DA ELETR., O","GREENFIELD, PATRICIA MARK",SUMMUS,"59,70","29,85"
"DESENVOLVIMENTO E APRENDIZAGEM EM PIAGET E VIGOTSKI - EDIÇÃOREVISTA","PALANGANA, ISILDA CAMPANER",SUMMUS,"62,80","31,40"
"DESEQUILIBRIOS ESTATICOS, OS","MARCEL, BIENFAIT",SUMMUS,"86,40","43,20"
DESFAZENDO MITOS,"SEGAL, SANDRA MEGRICH",ÁGORA,"42,80","21,40"
"DESPERTAR DO TIGRE, O","LEVINE, PETER,A.;FREDERICK,ANN",SUMMUS,"78,90","39,45"
"DESPERTAR PARA O OUTRO, O","COSTA, CLARICE MOURA",SUMMUS,"48,20","24,10"
"DEUSA FERIDA, A","BORELLI,SILVIA/PRIOLLI,GABRIEL",SUMMUS,"87,80","43,90"
"DIAFRAGMA, O","SOUCHARD, PH E",SUMMUS,"42,80","21,40"
DIAGNÓSTICO CLÍNICO POSTURAL - ED. REVISTA AMPLIADA,"SANTOS, MARIA ÂNGELA",SUMMUS,"83,70","41,85"
DIÁRIO DE BOLLYWOOD,"BALLERINI, FRANTHIESCO",SUMMUS,"53,10","26,55"
DIÁRIO DE UM GRAVIDO,"KAUFMANN, RENATO",MESCLA,"57,10","28,55"
"DICIONÁRIO DE GESTALT-TERAPIA - ""GESTALTÊS"" EDIÇÃO REVISTA EAMPLIADA",GLADYS/SHEILA/PATRÍCIA (ORGS),SUMMUS,"93,10","46,55"
DICIONÁRIO DE PSICODRAMA E SOCIODRAMA,"MENEGAZZO, CARLOS MARIA E OUTR",ÁGORA,"76,00","38,00"
DICIONÁRIO DE RELAÇÕES ÉTNICAS E RACIAIS,"CASHMORE, ELLIS",SELO NEGRO,"120,90","60,45"
DICIONÁRIO ESCOLAR AFRO-BRASILEIRO - EDIÇÃO REVISTA,"LOPES, NEI BRAZ",SELO NEGRO,"56,90","28,45"
DICIONARIO PROFISSIONAL DE REL. PUBL. E COM.,"ANDRADE, CANDIDO TEOBALDO DE S",SUMMUS,"59,70","29,85"
DIETA DISSOCIADA,"SOARES, JOÃO CESAR CASTRO",MG EDITORES,"51,00","25,50"
DIFERENÇAS E PRECONCEITO NA ESCOLA,"AQUINO, JULIO GROPPA (ORG.)",SUMMUS,"71,60","35,80"
DIFERENTES DESEJOS,"PICAZIO, CLAUDIO",EDIÇÕES GLS,"59,70","29,85"
"DILEMA DA PSICOLOGIA, O","LESHAN, LAWRENCE",SUMMUS,"62,80","31,40"
DIRECAO DE CAMERA,"WATTS, HARRIS",SUMMUS,"42,80","21,40"
"DIREITO DA CRIANCA AO RESPEITO, O",KORCZAK/DALLARI,SUMMUS,"42,80","21,40"
DIREITO LGBTI - PERGUNTAS E RESPOSTAS,"ZEGER, IVONE",MESCLA,"85,90","42,95"
"DISLEXIA EM QUESTÃO, A","MASSI, GISELLE AP. DE ATHAYDE",PLEXUS,"84,60","42,30"
DISTÚRBIOS DE LINGUAGEM E TEATRO,"TONEZZI, JOSÉ",PLEXUS,"51,00","25,50"
DIVIDIR PARA SOMAR,"CAPOSSELA, CAPPY E WARNOCK, S.",ÁGORA,"84,60","42,30"
DO SELF E DA IPSEIDADE,"RIBEIRO, JORGE PONCIANO",SUMMUS,"68,80","34,40"
DO TRAUMA À CURA,"ROSS, GINA",SUMMUS,"65,70","32,85"
DOCUMENTÁRIO NO BRASIL,"TEIXEIRA, FRANCISCO E. (ORG)",SUMMUS,"114,00","57,00"
DOENÇA DE ALZHEIMER,"POIRIER, JUDES; GAUTHIER, SERGE",MG EDITORES,"71,40","35,70"
"DOENÇA MENTAL, UM TRATAMENTO POSSÍVEL","SILVA FILHO, LUIS ALTENFELDER",ÁGORA,"101,10","50,55"
DOMINIO DO MOVIMENTO,"LABAN, RUDOLF",SUMMUS,"90,60","45,30"
DORES CRÔNICAS,"CATALANO, H.M./KIMERON, N.H.",SUMMUS,"129,40","64,70"
"DRAMA DA CRIANCA BEM DOTADA, O","MILLER, ALICE",SUMMUS,"42,80","21,40"
DROGAS - PERGUNTAS E RESPOSTAS,"BRAUN, IVAN MARIO",MG EDITORES,"67,90","33,95"
DROGAS NA ESCOLA,"AQUINO, JULIO G. (ORG)",SUMMUS,"59,70","29,85"
"DURMA BEM, VIVA MELHOR","ALBERNAZ, PEDRO LUIZ M. (ORG)",MG EDITORES,"42,80","21,40"
E A LOUCA TINHA RAZÃO!,"LEONARD, LINDA S.",SUMMUS,"112,00","56,00"
"E AGORA, O QUE FAZER?","RAMOS,MAGDALENA M.;POSTERNAK, LEONARDO",ÁGORA,"79,80","39,90"
E SE O PSICODRAMA TIVESSE NASCIDO NO CINEMA?,"MASSARO, GERALDO",ÁGORA,"42,80","21,40"
E UMA MENINA!,"RUTTER, VIRGINIA BEANE",ÁGORA,"53,10","26,55"
EDUCAÇÃO A DISTÂNCIA,"AMORIM, VALÉRIA",SUMMUS,"51,00","25,50"
EDUCAÇÃO ARTÍSTICA: LUXO OU NECESSIDADE?,"PORCHER, LOUIS (ORG)",SUMMUS,"67,90","33,95"
EDUCAÇÃO COMO PRÁXIS POLÍTICA,"GUTIERREZ, FRANCISCO",SUMMUS,"48,20","24,10"
EDUCAÇÃO DE SURDOS,"ARANTES,VALÉRIA AMORIM (ORG)",SUMMUS,"68,80","34,40"
EDUCAÇÃO DO QUERER,"DI NIZO, RENATA",ÁGORA,"53,10","26,55"
EDUCAÇÃO E COMPETÊNCIAS,"ARANTES, VALERIA AMORIM (ORG)",SUMMUS,"59,70","29,85"
EDUCAÇÃO E VALORES,"ARANTES, VALERIA AMORIM (ORG.)",SUMMUS,"59,70","29,85"
EDUCAÇÃO FAMILIAR E ESCOLAR PARA O TERCEIRO MILÊNI,"GAIARSA, JOSÉ ANGELO",ÁGORA,"94,50","47,25"
EDUCAÇÃO FORMAL E NÃO-FORMAL,"ARANTES, VALÉRIA AMORIM (ORG)",SUMMUS,"59,70","29,85"
EDUCAÇÃO MOTORA EM PORTADORES DE DEFICIÊNCIA,"FRUG, CHRYSTIANNE SIMÕES",PLEXUS,"42,80","21,40"
EDUCAÇÃO OU O QUÊ?,"MAUTNER, ANNA VERONICA",SUMMUS,"48,20","24,10"
"EDUCAÇÃO PELA DANÇA, A","OSSONA, PAULINA",SUMMUS,"62,80","31,40"
EDUCAR FILHOS - ENTRE A RENÚNCIA E A URGÊNCIA,"POSTERNAK, LEONARDO",ÁGORA,"42,80","21,40"
