"EGO, FOME E AGRESSÃO","PERLS, FREDERICK S.",SUMMUS,"114,00","57,00"
ELEICAO É GUERRA,"MANHANELLI, CARLOS AUGUSTO",SUMMUS,"48,20","24,10"
ELEMENTOS PARA UMA COMPREENSÃO DIAGNÓSTICA EM PSICOTERAPIA,"BRITO, ÊNIO",SUMMUS,"51,00","25,50"
ELOGIO A JACQUES LACAN,"ALMEIDA, WILSON CASTELLO DE",SUMMUS,"95,50","47,75"
EM BUSCA DE DEUS,"ALBERNAZ, PEDRO LUIZ M.",ÁGORA,"62,80","31,40"
EMAGREÇA PELA CABEÇA,"GODOY, ANTONIO CARLOS MARSIGLI",MG EDITORES,"42,80","21,40"
ENCICLOPÉDIA BRAS DA DIASPORA AFRICANA - ED. REV. E AMPLIADA,"LOPES, NEI BRAZ",SELO NEGRO,"252,80","126,40"
ENERGIA VITAL PELA BIOENERGETICA SUAVE,EVA REICH/ ESZTER ZORNANSZKY,SUMMUS,"86,40","43,20"
ENFRENTANDO A AUDIÊNCIA,"DILTS, ROBERT",SUMMUS,"68,80","34,40"
ENFRENTANDO CRISES E FECHANDO GESTALTEN,"FRAZÃO, LILIAN; FUKUMITSU, KARINA (ORGS.)",SUMMUS,"51,00","25,50"
ENIGMA BIPOLAR,"TUNG, TENG CHEI",MG EDITORES,"57,10","28,55"
ENSAIOS SOBRE O AMOR E A SOLIDÃO - ED. REVISTA,"GIKOVATE, FLAVIO",MG EDITORES,"90,60","45,30"
ENSINANDO A APRENDER,"NOT, LOUIS",SUMMUS,"59,70","29,85"
ENSINO DE CIÊNCIAS,"ARANTES, VALÉRIA AMORIM (ORG)",SUMMUS,"65,70","32,85"
ENSINO DE MATEMÁTICA,"ARANTES, VALÉRIA AMORIM (ORG)",SUMMUS,"62,80","31,40"
ENTRE MULHERES,"MODESTO, EDITH",EDIÇÕES GLS,"59,70","29,85"
ENTRE PSIQUÊ E SOMA,"BOYESEN, GERDA",SUMMUS,"65,70","32,85"
ENTRE VISTAS,"HILLMAN, JAMES",SUMMUS,"67,90","33,95"
EQUILÍBRIO HORMONAL E QUALIDADE DE VIDA,"KLEPACZ, SÉRGIO",MG EDITORES,"42,80","21,40"
EQUIPES SOLIDÁRIAS,"DI NIZO, RENATA",SUMMUS,"48,20","24,10"
ERA UMA VEZ UM CASAL DIFERENTE,"FACCO, LÚCIA",SUMMUS,"96,50","48,25"
ERA UMA VEZ...,"EL-JAICK, MÁRCIO",EDIÇÕES GLS,"48,20","24,10"
"EROTISMO, SEXUALIDADE, CASAMENTO E INFIDELIDADE","ZAMPIERI, ANA MARIA FONSECA",ÁGORA,"81,80","40,90"
ERRO E FRACASSO NA ESCOLA,"AQUINO, JULIO GROPPA (ORG.)",SUMMUS,"57,10","28,55"
ESBOÇO PARA UMA TEORIA DA CENA,"MASSARO,GERALDO",ÁGORA,"42,80","21,40"
ESCARAFUNCHANDO FRITZ,"PERLS, FREDERICK S.",SUMMUS,"84,60","42,30"
"ESCOLA COMO ESPACO DE PRAZER, A","LIMA E GOMES, ICLEIA R.",SUMMUS,"84,60","42,30"
"ESCOLA E A PRODUÇÃO TEXTUAL, A","COLELLO, SILVIA M. GASPARIAN",SUMMUS,"76,90","38,45"
"ESCOLA PARA TODOS E PARA CADA UM, A","GALERY, AUGUSTO (ORG.)",SUMMUS,"62,80","31,40"
"ESCOLA QUE (NÃO) ENSINA A ESCREVER, A","COLELLO, SILVIA M. GASPARIAN",SUMMUS,"74,90","37,45"
"ESCOLHA PROFISSIONAL, A","SOARES, DULCE HELENA PENNA",SUMMUS,"67,90","33,95"
"ESCOLIOSE, A","PERDRIOLLE, RENÉ",SUMMUS,"86,40","43,20"
ESCRITA CRIATIVA,"DI NIZO, RENATA",SUMMUS,"51,00","25,50"
ESCRITA E AFASIA,"SANTANA, ANA PAULA DE OLIVEIRA",PLEXUS,"57,10","28,55"
"ESCULTURA NA PSICOTERAPIA , A","BARBACH, ELISA/ KNAPPE, PABLO",ÁGORA,"87,80","43,90"
"ESCUTA DO CORPO, A","MILLER, JUSSARA CORRÊA",SUMMUS,"48,20","24,10"
"ESPELHO MÁGICO, O - EDIÇÃO REVISTA","GAIARSA, JOSÉ ANGELO",ÁGORA,"42,80","21,40"
"ESPELHO PARTIDO, O","BARROS, RUI SÁ SILVA",ÁGORA,"59,70","29,85"
"ESPIRAL DA VIDA, A",WICKENBURG/MEYER,ÁGORA,"62,80","31,40"
ESPÍRITO REVOLUCIONÁRIO,"PAUL, HAYDN",ÁGORA,"67,90","33,95"
"ESPIRITUALIDADE DO CORPO, A","LOWEN, ALEXANDER",SUMMUS,"60,30","30,15"
ESPONTANEIDADE CONSCIENTE,"ALON, RUTHY",SUMMUS,"137,80","68,90"
ESPREME QUE SAI SANGUE,"ANGRIMANI, DANILO",SUMMUS,"57,10","28,55"
ESSA COISA CHAMADA SEXO,"OSHLACK, IAN",ÁGORA,"64,20","32,10"
"ESSENCIA DA MENTE, A","ANDREAS, STEVE E CONNIRAE",SUMMUS,"92,10","46,05"
ESSÊNCIA E PERSONALIDADE,"FONSECA, JOSÉ",ÁGORA,"106,40","53,20"
"ESSENCIAL DE MORENO, O","FOX, JONATHAN",ÁGORA,"107,80","53,90"
ESTA QUENTE AQUI OU SOU EU?,"SAND, GAYLE",SUMMUS,"59,70","29,85"
"ESTATUTO DA IGUALDADE RACIAL, O","OLIVEIRA, SIDNEY DE PAULA",SELO NEGRO,"31,90","15,95"
ESTÉTICA DA VOZ - EDIÇÃO REVISTA E AMPLIADA,"QUINTEIRO, EUDÓSIA A.",PLEXUS,"59,70","29,85"
"ESTRATEGIA DA GENIALIDADE,  - ALBERT EINSTEIN","DILTS, ROBERT B.",SUMMUS,"67,90","33,95"
"ESTRATEGIA DA GENIALIDADE, A -ARISTÓTELES; MOZART;","DILTS, ROBERT B.",SUMMUS,"92,10","46,05"
"ESTRATÉGIA DA GENIALIDADE,A-FREUD, DA VINCI, TESLA","DILTS, ROBERT B.",SUMMUS,"112,00","56,00"
ESTRATÉGIAS ELEITORAIS,"MANHANELLI, CARLOS AUGUSTO",SUMMUS,"51,00","25,50"
ESTRUTURA DA INFORMAÇÃO RADIOFÔNICA,"PRADO, EMILIO",SUMMUS,"42,80","21,40"
"ESTRUTURA DA TRANSFORMAÇÃO, A","LUCCA, FERNANDO J. DE",SUMMUS,"84,60","42,30"
ESTUDOS DE PSICOPEDAGOGIA MUSICAL,"HEMSY DE GAINZA, VIOLETA",SUMMUS,"51,00","25,50"
"ÉTICA JORNALÍSTICA E O INTERESSE PÚBLICO, A","KARAM, FRANCISCO JOSÉ",SUMMUS,"92,10","46,05"
ÉTICA NA COMUNICAÇÃO - ED. REVISTA E ATUALIZADA,"BARROS FILHO, CLÓVIS DE",SUMMUS,"76,00","38,00"
"ÉTICA NOS GRUPOS, A",FEBRAP,ÁGORA,"62,80","31,40"
"ÉTICA, MÍDIA E COMUNICAÇÃO","MARQUES, ÂNGELA; MARTINO, LUÍS MAURO S.",SUMMUS,"78,90","39,45"
EU TE AMO! E AI?,"VISCOTT, DAVID",SUMMUS,"90,60","45,30"
EUTONIA E RELAXAMENTO,"BRIEGHEL-MULLER, GUNNA",SUMMUS,"66,40","33,20"
EVENTOS: ESTRATEGIAS DE PLANEJ. E EXECUÇÃO,"SILVA, MARIANGELA B R; FORTES, WALDYR G",SUMMUS,"76,00","38,00"
"EVIL, GOOD AND BEYOND","GIKOVATE, FLÁVIO",MG EDITORES,"55,60","27,80"
EXERCICIOS DE ARTE PARA GRUPOS,"LIEBMANN, MARIAN",SUMMUS,"94,50","47,25"
EXERCÍCIOS DE BIOENERGÉTICA - EDIÇÃO REVISTA,"LOWEN, ALEXANDER; LOWEN, LESLIE",ÁGORA,"53,10","26,55"
"EX-MARIDO, PAI PRESENTE","PALERMO, ROBERTA",MESCLA,"42,80","21,40"
"EXPERIÊNCIA ANORÉXICA, A","LAWRENCE, MARILYN",SUMMUS,"51,00","25,50"
EXPERIÊNCIAS CONTEMPORÂNEAS SOBRE A MORTE E O MORRER,"LUZ, RODRIGO; BASTOS, DANIELA FREITAS",SUMMUS,"68,80","34,40"
EXPERIÊNCIAS DA EMANCIPAÇÃO,"GOMES, FLÁVIO; DOMINGUES, PETRÔNIO",SELO NEGRO,"103,70","51,85"
EXPRESSÃO CORPORAL NA PRÉ-ESCOLA,STOKOE/HARF,SUMMUS,"53,10","26,55"
FALANDO COM SEU FILHO SOBRE SEXO,CALDERONE/RAMEY,SUMMUS,"42,80","21,40"
FALANDO DE AMOR,"NAFFAH NETO, ALFREDO (ORG)",ÁGORA,"59,70","29,85"
FALANDO DO CORPO,"CIPULLO, MARCOS A. T.",SUMMUS,"65,70","32,85"
FAMILIA - PERGUNTAS E RESPOSTAS - ED. REVISTA,"ZEGER, IVONE",MESCLA,"60,40","30,20"
"FAMÍLIA DE QUE SE FALA E A FAMÍLIA DE QUE SE SOFRE, A - EDIÇÃO REVISTA","GAIARSA, JOSÉ ANGELO",ÁGORA,"99,30","49,65"
"FAMILIA E A CURA, A","MATTHEWS-SIMONTON, STEPHANIE",SUMMUS,"68,80","34,40"
FAMILIA E MITOS,"KROM, MARILENE",SUMMUS,"78,90","39,45"
FASCIAS E POMPAGES,"BIENFAIT, MARCEL",SUMMUS,"68,90","34,45"
FAZ DUAS SEMANAS QUE MEU AMOR,"EL-JAICK, ANA PAULA",EDIÇÕES GLS,"42,80","21,40"
FAZENDO ARTE COM A CAMISINHA,"PAIVA, VERA",SUMMUS,"99,30","49,65"
FAZENDO CINEMA NA ESCOLA,"MOLETTA, ALEX",SUMMUS,"48,20","24,10"
FECHE OS OLHOS E VEJA,"TELLES, IZABEL",ÁGORA,"56,50","28,25"
"FEMININO E O SAGRADO, O","PICCHIA, BEATRIZ; BALIEIRO, MARIA CRISTI",ÁGORA,"96,70","48,35"
FÊNIX ASCENDENTE,"PAUL, HAYDN",ÁGORA,"64,20","32,10"
FENOMENOLOGIA E GESTALT-TERAPIA,"M-GRANZOTTO, MARCOS & ROSANE",SUMMUS,"111,20","55,60"
FERIDAS INVISIVEIS,"MILLER, MARY SUSAN",SUMMUS,"94,50","47,25"
FIBROMIALGIA SEM MISTÉRIO,"LAVÍN, MANUEL MARTÍNEZ",MG EDITORES,"64,20","32,10"
FILHOS ADOLESCENTES,"RIERA, MICHAEL",SUMMUS,"76,00","38,00"
"FILHOS DA TERRA DO SOL, OS","HERNANDEZ, LEILA MARIA G.L.",SELO NEGRO,"74,50","37,25"
"FILOSOFIA DO JEITO, A","BORGES, FERNANDA CARLOS",SUMMUS,"67,90","33,95"
"FILOSOFIA VAI À ESCOLA, A","LIPMAN, MATTHEW",SUMMUS,"84,60","42,30"
"FIM DO PESADELO, O","ADAMS CAREN/ FAY, JENNIFER",SUMMUS,"68,80","34,40"
"FIM DO SILÊNCIO NA VIOLÊNCIA FAMILIAR, O","FERRARI, DALKA C.,VECINA (ORGS",ÁGORA,"105,20","52,60"
"FIO DAS PALAVRAS, O","CANCELLO, LUIZ",SUMMUS,"42,80","21,40"
FOCO E CRIATIVIDADE,"DI NIZO, RENATA",SUMMUS,"53,10","26,55"
FONOAUDIOLOGIA E EDUCAÇÃO - ED.REVISTA,"BERBERIAN, ANA PAULA",PLEXUS,"51,00","25,50"
FONOAUDIOLOGIA E PSICANALISE,"CUNHA, MARIA CLAUDIA",PLEXUS,"57,10","28,55"
FONOAUDIOLOGIA EM CONTEXTOS GRUPAIS,"SANTANA, ANA PAULA; BERBERIAN, ANA PAULA",PLEXUS,"74,50","37,25"
FONOAUDIOLOGIA:RECRIANDO SEUS SENTIDOS,"PASSOS, MARIA CONSUÊLO (ORG)",PLEXUS,"57,10","28,55"
"FONOAUDIÓLOGO E A ESCOLA, O","FERREIRA, LESLIE PICCOLOTTO",PLEXUS,"51,00","25,50"
FORÇA DINÂMICA,"SEMIATZH, MARCELO; BLASS, ALEXANDRE",SUMMUS,"84,60","42,30"
"FORMA DO REAL, A",JOSEP MARIA CATALÀ DOMÈNECH,SUMMUS,"94,50","47,25"
FORMAÇÃO E INFORMAÇÃO AMBIENTAL,"VILAS BOAS, SERGIO (ORG)",SUMMUS,"68,80","34,40"
FORMAÇÃO E INFORMAÇÃO CIENTÍFICA,"VILAS BOAS, SERGIO (ORG)",SUMMUS,"48,20","24,10"
FORMAÇÃO E INFORMAÇÃO ECONÔMICA,"VILAS BOAS, SERGIO (ORG)",SUMMUS,"48,20","24,10"
FORMAÇÃO E INFORMAÇÃO ESPORTIVA,"VILAS BOAS, SERGIO LUIS (ORG)",SUMMUS,"57,10","28,55"
FORMAÇÃO E ROMPIMENTO DE VÍNCULOS,"FRANCO, MARIA H. PEREIRA (ORG.)",SUMMUS,"94,50","47,25"
FORMAÇÃO EM DANCATERAPIA,"FUX, MARIA",SUMMUS,"42,80","21,40"
"FORMAÇÃO PROFISSIONAL DO PSICOTERAPEUTA, A","CARDOSO, ELENIR ROSA GOLIN",SUMMUS,"48,20","24,10"
FORMANDO AGENTES DE TRANSFORMAÇÃO SOCIAL,"GAIARSA, JOSÉ ANGELO",ÁGORA,"42,80","21,40"
FOTOLEITURA,"SHEELE, PAUL R.",SUMMUS,"53,10","26,55"
FRAGMENTOS DE UM OLHAR PSICODRAMÁTICO,"PERAZZO, SERGIO",ÁGORA,"76,00","38,00"
FRAGMENTOS DE UMA VIDA,"MAUTNER, ANNA VERONICA",ÁGORA,"65,90","32,95"
"FREDERICK PERLS, VIDA E OBRA","HELOU, FÁDUA",SUMMUS,"68,80","34,40"
"FREUD E REICH, CONTINUIDADE OU RUPTURA?","WAGNER, CLÁUDIO M.",SUMMUS,"51,00","25,50"
FRUTAS QUE CURAM,"GONSALVES, PAULO EIRÓ",MG EDITORES,"64,20","32,10"
FUNDAMENTOS DO PSICODRAMA,"MORENO, J. L.",ÁGORA,"99,30","49,65"
GAGUEIRA: ORIGEM E TRATAMENTO,"FRIEDMAN, SILVIA",PLEXUS,"53,10","26,55"
GÊNEROS E FORMATOS NA TELEVISÃO BRASILEIRA - EDIÇÃO REVISTA,"SOUZA, JOSÉ CARLOS ARONCHI DE",SUMMUS,"67,90","33,95"
GERONTODRAMA: A VELHICE EM CENA,"COSTA, ELISABETH MARIA SENE",ÁGORA,"62,80","31,40"
GESTALT - UMA TERAPIA DO CONTATO,"GINGER, SERGE E ANNE",SUMMUS,"90,60","45,30"
GESTALT E GRUPOS,"TELLEGEN, THERESE A",SUMMUS,"48,20","24,10"
GESTALT E SONHOS,"LIMA FILHO, ALBERTO PEREIRA",SUMMUS,"78,90","39,45"
GESTALTPEDAGOGIA,SCHERPP/BUROW,SUMMUS,"65,70","32,85"
GESTALT-TERAPIA,PERLS/HEFFERLINE/GOODMAN,SUMMUS,"90,60","45,30"
GESTALT-TERAPIA - O PROCESSO GRUPAL,"RIBEIRO, JORGE PONCIANO",SUMMUS,"65,70","32,85"
GESTALT-TERAPIA COM CRIANÇAS,"AGUIAR, LUCIANA DE MEDEIROS",SUMMUS,"95,50","47,75"
GESTALT-TERAPIA DE CURTA DURAÇÃO - ED. REV.E AMP.,"RIBEIRO, JORGE PONCIANO",SUMMUS,"78,90","39,45"
GESTALT-TERAPIA EXPLICADA,"PERLS, FREDERICK S",SUMMUS,"112,40","56,20"
GESTALT-TERAPIA INTEGRADA,"POLSTER, ERVING E MIRIAM",SUMMUS,"102,40","51,20"
GESTALT-TERAPIA: CONCEITOS FUNDAMENTAIS,"FRAZÃO, LILIAN; FUKUMITSU, KARINA (ORGS.)",SUMMUS,"74,50","37,25"
"GESTALT-TERAPIA: FUNDAMENTOS EPISTEMOLÓGICOS E INFLUÊNCIASFILOSÓFICAS","FRAZÃO, LILIAN; FUKUMITSU, KARINA (ORGS.)",SUMMUS,"64,20","32,10"
GESTALT-TERAPIA: REFAZENDO UM CAMINHO - ED. REVISTA,"RIBEIRO, JORGE PONCIANO",SUMMUS,"68,80","34,40"
GESTÃO DE GRUPOS COMUNITÁRIOS,JEROME LISS,SUMMUS,"60,40","30,20"
"GESTOS DE CUIDADO, GESTOS DE AMOR","TRINDADE, ANDRÉ",SUMMUS,"115,70","57,85"
GIKOVATE ALÉM DO DIVÃ,"GIKOVATE, FLÁVIO",MG EDITORES,"59,10","29,55"
GINÁSTICA FACIAL ISOMÉTRICA,"PETKOVA, MARGUERITE",ÁGORA,"42,80","21,40"
GINÁSTICA HOLÍSTICA,"MENDONCA, MARIA EMILIA",SUMMUS,"90,60","45,30"
GLAUCOMA,"SUSANNA JR., REMO",MG EDITORES,"39,80","19,90"
"GRAFOLOGIA EXPRESSIVA - ED.REVISTA, ATUAL.E AMP","CAMARGO, PAULO SÉRGIO DE",ÁGORA,"106,40","53,20"
"GRAFOLOGIA NO RECRUTAMENTO E SELEÇÃO DE PESSOAL, A","CAMARGO, PAULO SÉRGIO DE",ÁGORA,"90,60","45,30"
GRAFOLOGIA PARA TODOS,"XANDRÓ, MAURICIO",ÁGORA,"84,60","42,30"
"GRANDE FILME,O","EPSTEIN, EDWARD JAY",SUMMUS,"120,90","60,45"
GRRRLS GAROTAS IRADAS,"LEONEL, VANGE",EDIÇÕES GLS,"53,10","26,55"
GRUPOS - A PROPOSTA DO PSICODRAMA,"ALMEIDA, WILSON CASTELLO DE",ÁGORA,"68,80","34,40"
GRUPOS E INTERVENÇÃO EM CONFLITOS,"NERY, MARIA DA PENHA",ÁGORA,"81,80","40,90"
GRUPOS E TERAPIA OCUPACIONAL,"LIBERMAN, FLÁVIA; MAXIMINO, VIVIANE",SUMMUS,"96,50","48,25"
GRUPOS-INTERV.SOCIOEDUCATIVA E MÉT.SOCIOPSICODRAMÁ,"FLEURY, HELOISA;MARRA, MARLENE",ÁGORA,"74,50","37,25"
GUERRA E IMPRENSA,"GOYZUETA,VERÓNICA;OGIER,T.(ORG",SUMMUS,"48,20","24,10"
"GUERRA SANTA DO GATO, A","LISBOA, LUIZ CARLOS",SELO NEGRO,"62,80","31,40"
GUERREIRAS DE NATUREZA - SANKOFA 3,"NASCIMENTO, ELISA LARKIN (ORG)",SELO NEGRO,"88,00","44,00"
GUIA DO ASTRÓLOGO INICIANTE,"CUNNINGHAM, DONNA",ÁGORA,"78,90","39,45"
GUIA PRÁTICO DE MEDIAÇÃO DE CONFLITOS -ED. REVISTA,"MUSZKAT, MALVINA ESTER",SUMMUS,"38,60","19,30"
GUIAS ÁGORA-ABORTO ESPONTÂNEO,"MARKHAM, URSULA",ÁGORA,"48,30","24,15"
GUIAS ÁGORA-ANOREXIA E BULIMIA,"BUCKROYD, JULIA",ÁGORA,"48,30","24,15"
"GUIAS ÁGORA-ANSIEDADE,FOBIAS E SINDROME DE PANICO","SHEEHAN, ELAINE",ÁGORA,"48,30","24,15"
GUIAS ÁGORA-BAIXA AUTO-ESTIMA,"SHEEHAN, ELAINE",ÁGORA,"48,30","24,15"
GUIAS ÁGORA-DEPRESSÃO,"BRETON, SUE",ÁGORA,"48,30","24,15"
GUIAS ÁGORA-DEPRESSÃO PÓS-PARTO,"HARVEY, ERIKA",ÁGORA,"48,30","24,15"
GUIAS ÁGORA-ESTRESSE,"SIMMONS, ROCHELLE",ÁGORA,"48,30","24,15"
GUIAS ÁGORA-INSÔNIA,"DAVIES, DILYS",ÁGORA,"48,30","24,15"
GUIAS ÁGORA-LUTO,"MARKHAM, URSULA",ÁGORA,"48,30","24,15"
GUIAS ÁGORA-MAUS HÁBITOS ALIMENTARES,"GONSALVES, PAULO EIRÓ",ÁGORA,"48,30","24,15"
GUIAS ÁGORA-TIMIDEZ,"CRAWFORD, LYNNE/TAYLOR, LINDA",ÁGORA,"48,30","24,15"
GUIAS ÁGORA-TRAUMAS DE INFÂNCIA,"MARKHAM, URSULA",ÁGORA,"48,30","24,15"
GUIAS ÁGORA-VICIOS,"BOYD, DEIRDRE",ÁGORA,"48,30","24,15"
HARMONIZE SEU SISTEMA CRANIOSSACRAL,"AGUSTONI, DANIEL",SUMMUS,"93,10","46,55"
HERANÇA: PERGUNTAS E RESPOSTAS - EDIÇÃO REVISTA,"ZEGER, IVONE",MESCLA,"74,40","37,20"
"HEROI COM ROSTO AFRICANO, O","FORD, CLYDE W.",SELO NEGRO,"96,50","48,25"
"HEROÍNAS SAEM DO ARMÁRIO, AS","FACCO, LÚCIA",EDIÇÕES GLS,"65,70","32,85"
HIPERATIVIDADE,"JONES, MAGGIE",PLEXUS,"48,20","24,10"
HISTÓRIA DA ÁFRICA E AFRO-BRASILEIRA,"MELO; ELISABETE S.; BRAGA, LUCIANO V.",SELO NEGRO,"31,90","15,95"
HISTÓRIA DO CINEMA MUNDIAL,"BALLERINI, FRANTHIESCO",SUMMUS,"106,40","53,20"
HISTÓRIAS DE CONTAR E DE ESCREVER,"PERROTTA, MASINI, MARTZ",SUMMUS,"42,80","21,40"
HISTÓRIAS QUE CURAM,"REMEN, RACHEL NAOMI",ÁGORA,"92,10","46,05"
HISTÓRIAS QUE EDUCAM,"ESPIRITO SANTO, RUY CEZAR",ÁGORA,"42,80","21,40"
"HOLISMO, ECOLOGIA E ESPIRITUALIDADE","RIBEIRO, JORGE PONCIANO",SUMMUS,"74,50","37,25"
"HOMEM SUBJUGADO, O","MUSZKAT, MALVINA",SUMMUS,"62,80","31,40"
HORAS VAGAS,"EL-JAICK, MÁRCIO",EDIÇÕES GLS,"64,20","32,10"
HUMOR E ALEGRIA NA EDUCAÇÃO,"ARANTES, VALÉRIA AMORIM (ORG)",SUMMUS,"65,70","32,85"
IDA ROLF FALA,"FEITIS, ROSEMARY",SUMMUS,"74,50","37,25"
IDEIAS,GUY AZNAR,SUMMUS,"95,50","47,75"
IDÉIAS SOBRE IDÉIAS,"MENNA BARRETO, ROBERTO",SUMMUS,"48,20","24,10"
IDENTIDADE E SURDEZ,"SILVA, MARÍLIA DA P. MARINHO",PLEXUS,"51,00","25,50"
IMAGENS DO SELF,"WEINRIB, ESTELLE L",SUMMUS,"53,10","26,55"
IMAGENS QUE CURAM,"EPSTEIN, GERALD",ÁGORA,"76,00","38,00"
"IMAGINAÇÃO NA CURA, A","ACHTERBERG, JEANNE",SUMMUS,"78,90","39,45"
"IMAGINAÇÃO, CRIANÇA E ESCOLA","SILVA, DANIELE NUNES HENRIQUE",SUMMUS,"48,20","24,10"
"IMAGINÁRIO, COTIDIANO E PODER","DA SILVA, VAGNER GONÇALVES(ORG",SELO NEGRO,"68,80","34,40"
IMPRENSA NEGRA NO BRASIL DO SÉCULO XIX,"PINTO, ANA FLÁVIA MAGALHÃES",SELO NEGRO,"31,90","15,95"
INCLUSÃO COMEÇA EM CASA,"PROENÇA, IVA FOLINO",ÁGORA,"51,00","25,50"
INCLUSÃO E EDUCAÇÃO,"RODRIGUES, DAVID ANTÓNIO (ORG)",SUMMUS,"100,90","50,45"
INCLUSÃO ESCOLAR,"ARANTES,VALÉRIA AMORIM (ORG)",SUMMUS,"42,80","21,40"
INCLUSÃO ESCOLAR - O QUE É? POR QUÊ? COMO FAZER?,"MANTOAN, MARIA TERESA EGLÉR",SUMMUS,"42,80","21,40"
INCLUSÃO NA PRÁTICA,"RAMOS HENZ, ROSSANA REGINA G.",SUMMUS,"48,20","24,10"
"INCONSCIÊNCIA COLETIVA, A","GAIARSA, JOSÉ ANGELO",ÁGORA,"81,80","40,90"
INDISCIPLINA NA ESCOLA  -  F,"AQUINO, JULIO ROBERTO GROPPA",SUMMUS,"53,10","26,55"
INDIVIDUALIDADE:AFIRM.E NEGAÇÃO NA SOC.CAPITALISTA,"PALANGANA, ISILDA CAMPANER",SUMMUS,"67,90","33,95"
INFÂNCIA NA GESTALT-TERAPIA,"ANTONY, SHEILA; ZANELLA, ROSANA (ORG.)",SUMMUS,"74,50","37,25"
"INFÂNCIA, LIBERDADE E ACOLHIMENTO","CAMPOS REZENDE, TÂNIA; G. DE SÁ, VITÓRIA",SUMMUS,"93,10","46,55"
"INFORMAÇÃO NO RÁDIO, A","ORTRIWANO, GISELA SWETLANA",SUMMUS,"48,20","24,10"
"INFORMAÇÃO, INTELIGÊNCIA E UTOPIA","SIMÕES, ROBERTO PORTO",SUMMUS,"48,20","24,10"
"INFORMAL, NÔMADE TRADICIONAL","CANCELLO, LUIZ",SUMMUS,"48,20","24,10"
INTEGRANDO DIFERENÇAS,"LEVY, LAURICE",ÁGORA,"68,80","34,40"
"INTERVENÇÃO PSICOLÓGICA EM EMERGÊNCIAS, A","FRANCO, MARIA HELENA PEREIRA (ORG)",SUMMUS,"105,20","52,60"
INTERVENÇÕES GRUPAIS - O PSICODRAMA E SEUS MÉTODOS,"NERY, MARIA P.; CONCEIÇAO, MARIA INÊS G.",ÁGORA,"98,00","49,00"
INTERVENÇÕES GRUPAIS NA EDUCAÇÃO,"FLEURY,HELOISA /MARRA, MARLENE",ÁGORA,"59,70","29,85"
INTERVENÇÕES GRUPAIS NA SAÚDE,"FLEURY, HELOISA/MARRA,MARLENE",ÁGORA,"51,00","25,50"
INTERVENÇÕES GRUPAIS NAS ORGANIZAÇÕES,"FLEURY, HELOISA/MARRA, MARLENE",ÁGORA,"59,70","29,85"
INTERVENÇÕES GRUPAIS NOS DIREITOS HUMANOS,"FLEURY, HELOISA/MARRA, MARLENE",ÁGORA,"57,10","28,55"
INTRODUÇÃO À PROGRAMACAO NEUROLINGUISTICA,O'CONNOR & SEYMOUR,SUMMUS,"76,00","38,00"
INTRODUÇÃO À VISÃO HOLÍSTICA - EDIÇÃO REVISTA,"CREMA, ROBERTO DE S.",SUMMUS,"62,80","31,40"
INTRODUÇÃO AO PSICODRAMA,"ROJAS-BERMÚDEZ, JAIME G.,",ÁGORA,"59,70","29,85"
INVENTÁRIO DE AFETOS,"MERENGUÉ, DEVANIR",ÁGORA,"62,80","31,40"
IRMÃOS SEM RIVALIDADE,"FABER, ADELE; MAZLISH, ELAINE",SUMMUS,"74,50","37,25"
ISTO É GESTALT,"STEVENS, JOHN O (ORG.)",SUMMUS,"111,20","55,60"
JACOB LEVY MORENO - 1889/1974,"MARINEAU, RENÉ F",ÁGORA,"67,90","33,95"
JACOB LEVY MORENO - AUTOBIOGRAFIA,"MORENO, J. L.",ÁGORA,"64,20","32,10"
JINGLES ELEITORAIS E MARKETING POLÍTICO,"MANHANELLI, CARLOS A. BUONACORSO",SUMMUS,"81,80","40,90"
JOÃO CÂNDIDO - RETRATOS DO BRASIL NEGRO,"GRANATO, FERNANDO DE LIMA",SELO NEGRO,"31,90","15,95"
JOGANDO A SÉRIO,"BELLO, MARÍA CARMEN",ÁGORA,"71,60","35,80"
"JOGO DRAMÁTICO INFANTIL, O","SLADE, PETER",SUMMUS,"42,80","21,40"
"JOGO E A CRIANÇA, O","CHATEAU, JEAN",SUMMUS,"51,00","25,50"
JOGO E PROJETO,"ARANTES,VALERIA AMORIM (ORG)",SUMMUS,"51,00","25,50"
"JOGO NO PSICODRAMA, O","MOTTA, JULIA (ORG)",ÁGORA,"51,00","25,50"
JOGOS DRAMÁTICOS,"MONTEIRO, REGINA FOURNEAUT",ÁGORA,"42,80","21,40"
JOGOS PARA EDUCAÇÃO EMPRESARIAL,"DATNER, YVETTE",ÁGORA,"51,00","25,50"
"JOGOS PSICOTICOS NA FAMILIA, OS",PAZZOLI/CIRILLO/SELVINI/SORREN,SUMMUS,"102,40","51,20"
JOGOS: REPETIÇÃO OU CRIAÇÃO?,"MOTTA, JULIA",ÁGORA,"51,30","25,65"
JORNALISMO CULTURAL NO SÉCULO 21,"BALLERINI, FRANTHIESCO",SUMMUS,"83,70","41,85"
JORNALISMO DIANTE DAS CÂMERAS,"YORKE, IVOR",SUMMUS,"68,80","34,40"
"JORNALISMO EM RETRAÇÃO, PODER EM EXPANSÃO","GANDOUR, RICARDO",SUMMUS,"48,20","24,10"
JORNALISMO EMPRESARIAL,GAUDÊNCIO TORQUATO,SUMMUS,"65,70","32,85"
JORNALISMO FREELANCE,"RAINHO, JOÃO MARCOS",SUMMUS,"48,20","24,10"
JORNALISMO INVESTIGATIVO,"SEQUEIRA, CLEOFE MONTEIRO DE",SUMMUS,"67,90","33,95"
"JORNALISMO NA ERA DA PUBLICIDADE, O","MARSHALL, LEANDRO DA ROSA",SUMMUS,"64,20","32,10"
JORNALISMO NA INTERNET,"PINHO, JOSÉ BENEDITO",SUMMUS,"94,50","47,25"
JORNALISMO ORGANIZACIONAL,"SÓLIO, MARLENE BRANCA",SUMMUS,"68,80","34,40"
"JORNALISMO, ÉTICA E LIBERDADE - ED. REVISTA","KARAM, FRANCISCO JOSÉ",SUMMUS,"76,00","38,00"
JORNALISTAS INTELECTUAIS NO BRASIL,"PEREIRA, FÁBIO HENRIQUE",SUMMUS,"72,50","36,25"
JORNALISTAS LITERÁRIOS,"VILAS BOAS, SERGIO (ORG)",SUMMUS,"100,90","50,45"
JORNAL-LABORATÓRIO,"LOPES, DIRCEU FERNANDES",SUMMUS,"65,70","32,85"
"JUIZO MORAL NA CRIANÇA, O","PIAGET, JEAN",SUMMUS,"98,00","49,00"
JULIETA E JULIETA,"MESQUITA, FATIMA",EDIÇÕES GLS,"51,00","25,50"
JUNG,"HUMBERT, ELIE G",SUMMUS,"53,10","26,55"
JUNHO DE 2013,"FIGUEIREDO, RUBENS (ORG.)",SUMMUS,"57,10","28,55"
KNOW-HOW,BANDLER/GORDON/LEBEAU,SUMMUS,"76,00","38,00"
LABAN PLURAL,"SCIALOM, MELINA",SUMMUS,"65,70","32,85"
"LABIRINTO HUMANO, O","BAKER, ELSWORTH F BAKER",SUMMUS,"102,40","51,20"
LAÇOS AMOROSOS,"VITALE, MARIA AMALIA F. (ORG)",ÁGORA,"84,60","42,30"
LAÇOS E NÓS,"CARDELLA, BEATRIZ H. P.",ÁGORA,"65,70","32,85"
LADO B,"FACCO, LÚCIA",EDIÇÕES GLS,"42,80","21,40"
"LADO OBSCURO E TENTADOR DO SEXO, O","ESPÍRITO SANTO, PATRÍCIA",ÁGORA,"62,80","31,40"
"LEGADO DE J. A. GAIARSA, O","BORGES, FERNANDA CARLOS (ORG.)",ÁGORA,"59,70","29,85"
"LEGIÃO NEGRA, A","FAUSTINO, OSWALDO ANTONIO",SELO NEGRO,"74,50","37,25"
LEITURA E DIFERENCIACAO DO MITO,"PACCOLA, MARILENE KROM",SUMMUS,"42,80","21,40"
"LEITURA, ESCRITA E ENSINO","MORAIS, JACQUELINE; COELHO, VICTORIA W.",SUMMUS,"78,90","39,45"
LÉLIA GONZALEZ - RETRATOS DO BRASIL NEGRO,"RATTS, ALEX; RIOS, FLÁVIA M.",SELO NEGRO,"31,90","15,95"
"LÉSBICAS, AS","ARC, STÉPHANIE",EDIÇÕES GLS,"51,30","25,65"
LETRAMENTO,"BERBERIAN, ANA PAULA (ORG)",PLEXUS,"112,00","56,00"
LIBERDADE EMOCIONAL,"VISCOTT, DAVID",SUMMUS,"94,50","47,25"
"LIBERDADE POSSÍVEL, A - ED. REVISTA","GIKOVATE, FLAVIO",MG EDITORES,"100,90","50,45"
"LIBERTAÇÃO SEXUAL, A","GIKOVATE, FLAVIO",MG EDITORES,"65,70","32,85"
LIBERTE SUA PERSONALIDADE,"MALTZ, MAXWELL",SUMMUS,"68,80","34,40"
LIÇÕES DA LUZ,"RING, KENNETH/VALARINO,EVELYN",SUMMUS,"115,60","57,80"
LIÇÕES DE AMOR,"GAIARSA, JOSÉ ANGELO",ÁGORA,"94,50","47,25"
LIÇÕES DE JORNALISMO,"CUNHA, ODIR",SUMMUS,"57,10","28,55"
LIÇÕES DE PSICODRAMA,GONCALVES/WOLFF/ALMEIDA,ÁGORA,"42,80","21,40"
LIDERANÇA E LINGUAGEM CORPORAL,"CAMARGO, PAULO SÉRGIO DE",SUMMUS,"67,90","33,95"
LILITH E EVA,"PIRES, VALÉRIA FABRIZI",SUMMUS,"51,00","25,50"
LIMA BARRETO - RETRATOS DO BRASIL NEGRO,"SILVA, LUIZ (CUTI)",SELO NEGRO,"31,90","15,95"
"LINGUAGEM COMO PROCESSO TERAPEUTICO, A","FREIRE, REGINA MARIA",PLEXUS,"57,10","28,55"
LINGUAGEM CORPORAL,"CAMARGO, PAULO SERGIO DE",SUMMUS,"57,10","28,55"
"LINGUAGEM DA EMPATIA, A","AZRAK, DINA",SUMMUS,"42,80","21,40"
"LINGUAGEM DO MOVIMENTO CORPORAL, A - EDIÇÃO REVISTA","BRIKMAN, LOLA",SUMMUS,"48,20","24,10"
"LINGUAGEM DOS SENTIMENTOS, A","VISCOTT, DAVID",SUMMUS,"51,00","25,50"
LINGUAGEM ESCRITA,BERBERIAN/MASSI/GUARINELLO,PLEXUS,"65,70","32,85"
LITERATURA DE RELAÇÕES PÚBLICAS,LUIS ALBERTO FARIAS,SUMMUS,"59,70","29,85"
LITERATURA NEGRO-BRASILEIRA - CONSCIENCIA EM DEBATE,"SILVA, LUIZ",SELO NEGRO,"31,90","15,95"
LITERATURA NOS JORNAIS,"NINA, CLAUDIA MENDES",SUMMUS,"38,60","19,30"
"LIVRARIA DA ESQUINA, A","CONTE, NAOMI",EDIÇÕES GLS,"42,80","21,40"
LIVRO DOS ALIMENTOS,"GONSALVES, PAULO EIRO",MG EDITORES,"90,60","45,30"
LIVROS DEMAIS!,"ZAID, GABRIEL",SUMMUS,"39,80","19,90"
LOBAS E GRÁVIDAS,"RODRIGUES, LÍVIA P FIRME",ÁGORA,"42,80","21,40"
LONGA CARTA PARA MILA,"ORMOND, ANDRÉA",EDIÇÕES GLS,"42,80","21,40"
LUA DE PRATA,"BUSIN, VALÉRIA MELKI",EDIÇÕES GLS,"57,10","28,55"
"LÚDICO NOS GRUPOS, O","MONTEIRO, REGINA FOURNEAUT",ÁGORA,"42,80","21,40"
LUIZ GAMA - RETRATOS DO BRASIL NEGRO,"SANTOS, LUIZ CARLOS",SELO NEGRO,"31,90","15,95"
LUTO,"PARKES, COLIN MURRAY",SUMMUS,"96,50","48,25"
LUTO MATERNO E PSICOTERAPIA BREVE,"FREITAS, NELI KLIX",SUMMUS,"57,10","28,55"
LUTO POR PERDAS NÃO LEGITIMADAS NA ATUALIDADE,"CASELLATO, GABRIELA (ORG)",SUMMUS,"87,80","43,90"
LUZ NA VIDA - EDIÇÃO REVISTA,"IYENGAR, B.K.S.",SUMMUS,"107,80","53,90"
"MAGIA, MITO E PSICODRAMA","MENEGAZZO, CARLOS MARIA",ÁGORA,"48,20","24,10"
MAIS DO QUE PALAVRAS,DIMBLEBY/BURTON,SUMMUS,"74,50","37,25"
MAIS DO QUE UM JOGO,"KNAPPE, PABLO POBLACIÓN",ÁGORA,"67,90","33,95"
"MAL, O BEM E MAIS ALÉM, O","GIKOVATE, FLAVIO",MG EDITORES,"57,10","28,55"
MANUAL DA SAÚDE,"VIEIRA, ALEXANDRE ARANTE UBILLA",SUMMUS,"42,80","21,40"
"MANUAL DO ASTRÓLOGO,O",SAKOIAN/ACKER,ÁGORA,"116,10","58,05"
MANUAL DO BEM-VIVER,"STAUDER, ANTOINE JEAN M. P.",ÁGORA,"41,00","20,50"
MAPAS DO CORPO,"TRINDADE, ANDRÉ",SUMMUS,"98,90","49,45"
MARKETING POLÍTICO E GOVERNAMENTAL,FRANCISCO GAUDÊNCIO T. DO REGO,SUMMUS,"42,80","21,40"
MARKETING PÓS-ELEITORAL,"MANHANELLI, CARLOS AUGUSTO",SUMMUS,"48,20","24,10"
MASP 1970: O PSICODRAMA,"CEPEDA, NORIVAL A. / MARTIN, MARIA AP FE",ÁGORA,"67,90","33,95"
MATÉRIA BÁSICA,"EL-JAICK, MÁRCIO",EDIÇÕES GLS,"51,00","25,50"
MATERNIDADE INTERROMPIDA,"PONTES, MARIA MANUELA",ÁGORA,"71,60","35,80"
"MATRIZ AFRICANA NO MUNDO, A - SANKOFA I","NASCIMENTO, ELISA LARKIN (ORG)",SELO NEGRO,"88,00","44,00"
MEDIA TRAINING,"LUCAS, LUCIANE (ORG)",SUMMUS,"76,70","38,35"
MEDIAÇÃO DE CONFLITOS,"MUSZKAT, MALVINA ESTER (ORG)",SUMMUS,"84,60","42,30"
MEDIAÇÃO FAMILIAR TRANSDISCIPLINAR,"MUSZKAT, UBENHAUM E OLIVEIRA",SUMMUS,"39,80","19,90"
MEDIAÇÃO GRUPAL,"ANDALÓ, CARMEN",ÁGORA,"51,00","25,50"
"MEDICINA E MEDITAÇÃO - ED. REV., AMPL., ATUALIZADA","CARDOSO, ROBERTO ANTONIO DIAS",MG EDITORES,"53,10","26,55"
MEDICINA INTEGRATIVA,"LIMA, PAULO TARSO RICIERI DE",MG EDITORES,"51,00","25,50"
"MÉDICO E O PACIENTE, O","ISMAEL, J.C.",MG EDITORES,"53,10","26,55"
"MÉDICO E O RIO, O","CORADAZZI, ANA LUCIA; CANTADORI, LUCAS",MG EDITORES,"62,80","31,40"
MEDITAÇÃO JUDAICA,"KAPLAN, ARYEH",ÁGORA,"68,80","34,40"
MEDITAÇÕES DIRIGIDAS,"LEVINE, STEPHEN",ÁGORA,"92,10","46,05"
MEDO DA VIDA,"LOWEN, ALEXANDER",SUMMUS,"76,90","38,45"
MEIO SÉCULO DE PSICOTERAPIA VERBAL E CORPORAL,"GAIARSA, JOSÉ ANGELO",ÁGORA,"105,40","52,70"
"MELHOR TV DO MUNDO, A","FILHO, LAURINDO LALO LEAL",SUMMUS,"42,80","21,40"
MEMÓRIAS DE UM GATO,"LISBOA, LUIZ CARLOS",SELO NEGRO,"65,10","32,55"
"MENTE E O CÂNCER, A","BIZZARRI, MARIANO",SUMMUS,"81,80","40,90"
MENTIRAS QUE PARECEM VERDADES,"ECO, UMBERTO/BONAZZI, MARISA",SUMMUS,"51,00","25,50"
"MÉTODO CORPO INTENÇÃO, O","GERMANO, DENISE DE CASTRO",SUMMUS,"98,30","49,15"
"MÉTODO EMPRINT, O",BANDLER/GORDON/LEBEAU,SUMMUS,"96,50","48,25"
METODOLOGIA DA VEGETOTERAPIA CARACTERO-ANALÍTICA,"NAVARRO, FEDERICO",SUMMUS,"42,80","21,40"
MEU PRIMEIRO AMOR,"ELDER, LINDSEY",EDIÇÕES GLS,"51,00","25,50"
"MEU, O SEU, O NOSSO QUERER, O","DI NIZO, RENATA",ÁGORA,"57,10","28,55"
MINHA PROFISSÃO É ANDAR,"PECCI, JOÃO CARLOS",SUMMUS,"51,00","25,50"
MINHA QUERIDA MAMÃE - EDIÇÃO REVISTA,"GAIARSA, JOSÉ ANGELO",ÁGORA,"67,90","33,95"
