EAN / ISBN,Peso (g),Título,Autor,Categoria Principal,50%,Capa
9788576360957,260,ABILOLADO MUNDO NOVO,CARLOS MALTZ,COMPORTAMENTO,"R$25,00","50,00"
9788576361336,260,ARTIMANHAS DO ATOR,YOSHI OIDA,TEATRO,"R$17,50","35,00"
9788576361244,220,ASSASSINATOS EM FAMILIA,FLORIAN HOUSSIER,PSICANALISE,"R$30,00","60,00"
9788576361114,264,"ATOR ERRANTE, UM 2 ED",YOSHI OIDA,TEATRO,"R$18,50","37,00"
9788576360551,262,"ATOR INVISIVEL, O 2 ED",YOSHI OIDA; LORNA MARSHALL,TEATRO,"R$18,50","37,00"
9788586932281,160,AUSCHWITZ EXPLICADO A MINHA FILHA,ANNETTE WIEVIORKA,COMPORTAMENTO,"R$13,00","26,00"
9788576361121,230,"AVENTURAS DE RABI HARVEY, AS",STEVE SHEINKIN,HQ,"R$19,00","38,00"
9788576361053,320,"BIBLIA DA LIDERANCA, A",NATHAN LAUFER,RELIGIÃO,"R$22,45","44,90"
9788576361251,320,BIOPOLICA E PSICANALISE: VIAS DE ENCONTRO,MARCUS TESCHAINER E ORGS,PSICANALISE,"R$21,00","42,00"
9788576360865,290,CASTELO ADORMECIDO ESPINHEIRO VOL 1,LINDA MEDLEY,HQ,"R$19,50","39,00"
9788576361411,190,"CIDADE E AS SERRAS, A VL",ECA DE QUEIROS,LITERATURA,"R$10,00","20,00"
9788576360780,470,"CIENCIA, HISTORIA E HISTORIOGRAFIA",MAST,HISTORIA,"R$27,00","54,00"
9788576360476,170,"CLARICE LISPECTOR, ESSA DESCONHECIDA",JULIO LERNER,LITERATURA,"R$22,00","44,00"
9788576360018,260,"CLINICA DA CONSTRUCAO DO CORPO, UMA",MIRA WAJNTAL,PSICANALISE,"R$15,00","30,00"
9788576360667,280,COMO COELHOS,RALF KONIG,HQ,"R$20,50","41,00"
9788576361084,324,COMO LER A BIBLIA VOL.01,JAMES L. KUGEL,RELIGIÃO,"R$26,00","52,00"
9788576361251,280,COMPLEXO DE EDIPO EM FREUD E LACAN: UMA INTRO,RUOÇNÃOALÀDOFOMBAIANZDIO PEQUENOS HANS,PSICANALISE,"R$19,00","38,00"
9788576361428,750,CONVERSAS E MEMORIAS,GONCALO LUIZ DE MELO,PSICOLOGIA,"R$27,50","55,00"
9788576361237,190,"CORTICO, O",ALUISIO AZEVEDO,LITERATURA,"R$10,00","20,00"
9788586932106,120,CRONICAS DA PROVINCIA,WANDER ANTUNES; MOZART COUTO,HQ,"R$11,00","22,00"
9788586932427,180,"CULTURA EXPLICADA A MINHA FILHA, A",JEROME CLEMENT,COMPORTAMENTO,"R$16,50","33,00"
9788576360926,520,"DARWINISMO, MEIO AMBIENTE, SOCIEDADE",HELOISA BERTOL,CIENCIAS,"R$27,00","54,00"
9788576360698,340,"DEPRESSOES - AFETOS E HUMORES DO VIVER, AS",LUIS HORNSTEIN,PSICANALISE,"R$29,00","58,00"
9788576361060,260,"DONDE ESTAS,CORAZON",HELOISA VALENTE,MUSICA,"R$25,00","50,00"
9788576360858,220,DORES E ODORES,CRISTIANE ABUD,PSICANALISE,"R$19,00","38,00"
9788576360346,460,EBAL. FABRICA DE QUADRINHOS,EZEQUIEL DE AZEVEDO,SOBRE HQ,"R$31,00","62,00"
9788576360483,260,EM BUSCA DE UM LUGAR,ALESSANDRA MONACHESI RIBEIRO,PSICANALISE,"R$21,00","42,00"
9788576360063,240,ENSAIOS FREUDIANOS EM TORNO DA PSICOSSEXUALI,MADAERIA LUCIA VIEIRA VIOLANTE,PSICANALISE,"R$22,00","44,00"
9788586932236,230,ENTRE MOISES E FREUD,DANIEL DELOUYA,PSICANALISE,"R$18,00","36,00"
9788576360377,260,"FIGURAS DO PODER, AS",EUGENE ENRIQUEZ,SOCIOLOGIA,"R$42,00","84,00"
9788586932533,210,FORMAS DO VAZIO,CARMEM DA POIAN,PSICANALISE,"R$16,50","33,00"
9788586932441,375,FRONT7 - MUY VIEJO TO COMIX,FRONTBRAZA,HQ,"R$20,00","40,00"
9788586932519,340,FRONT8 - SOLO LA VERDAD ES SEXY,FRONTBRAZA,HQ,"R$19,50","39,00"
9788586932571,336,FRONT9 - A MARE,FRONTBRAZA,HQ,"R$20,00","40,00"
9788586932717,360,FRONT 10 - YO NO CREO EN LOS OTROS,FRONTBRAZA,HQ,"R$19,50","39,00"
9788586932786,275,FRONT 11 - VIOLENCIA,FRONTBRAZA,HQ,"R$17,50","35,00"
9771677886129,340,FRONT 12 - TRABALHO,FRONTBRAZA,HQ,"R$19,00","38,00"
9771677886068,360,FRONT 13 - FEMININO,FRONTBRAZA,HQ,"R$17,00","34,00"
9771677886099,341,FRONT 14 - HISTORIAS DE INFANCIA,FRONTBRAZA,HQ,"R$18,00","36,00"
9771677886068,250,FRONT 15 - ...TUDO EM VOLTA SENTE MEDO,FRONTBRAZA,HQ,"R$17,50","35,00"
9771677886068,260,FRONT 16 - MORTE,VARIOS,HQ,"R$17,50","35,00"
9771677886068,270,FRONT 17 - INVISIBILIDADE,FRONTBRAZA,HQ,"R$18,50","37,00"
9771677886068,256,FRONT 18 - ODIO,FRONTBRAZA,HQ,"R$15,50","31,00"
9771677886006,230,FRONT 19 - SONHO,FRONTBRAZA,HQ,"R$15,50","31,00"
9788576361206,310,FRONT 15 ANOS: UMA HISTORIA,FRONTBRAZA,HQ,"R$21,00","42,00"
9788576360704,275,FRONT ESPECIAL 1 - CENTENARIO DA IMIGRACAO JAP,NFERSONTBRAZA,HQ,"R$15,50","31,00"
9788586932908,380,FUNCOES ESTRUTURAIS DA HARMONIA,ARNOLD SCHOENBERG,MUSICA,"R$31,00","62,00"
9788576360520,220,"GARFADA DE MARKETING, UMA",DR. CARNEIRO,NUTRIÇÃO,"R$16,00","32,00"
9788586932724,180,GERINGONCA,GABRIEL DE MATTOS,LITERATURA,"R$13,50","27,00"
9788576361282,193,"GESTO SEM FIM, O: NOTAS DE UM PSICANALISTA AO L",RMARGCAUMSBETNESCHAINER,PSICANALISE,"R$17,50",
9788576360940,185,GIBI A REVISTA SINONIMO DE QUADRINHOS,ROBERTO ELISIO,,"R$14,00","28,00"
9788576360971,195,GORDO PENSANDO,LEO COUTINHO,LITERATURA,"R$17,50","35,00"
9788576361152,410,HARMONIA NO SECULO XX,VINCENT PERSICHETTI,MUSICA,"R$35,00","70,00"
9788576360544,210,HISTERIA FEMININA. A PROBLEMATICA IDENTIFICATORI,CLAUDIA ANDREA GORI,PSICANALISE,"R$14,50","29,00"
9788576360827,375,"HISTORIA DOS JUDEUS, A 2 ED",STAN MACK,HQ,"R$25,00","50,00"
9788576360834,202,HISTORIA E ALERGIA REV AMPLIADA,RAUL EMRICH MELO,SAUDE,"R$19,50","39,00"
9788576360674,220,LISTA DE TAREFA DE DEUS,RON WOLFSON,AUTO AJUDA,"R$21,00","42,00"
9788576360094,290,LUCIANO,PRIMAGGIO MANTOVI E FERNANDO BO,HINQI,"R$11,50","23,00"
"",185,MANGÁ TROPICAL,VÁRIOS,HQ,"R$14,50","29,00"
"",175,MONDO MUERTO 2,HENRIQUE KIPPER,HQ,"R$17,50","35,00"
9788576360339,220,MUSICA E MIDIA. NOVAS ABORDAGENS SOBRE A CANC,HOELOISA VALENTE,MUSICA,"R$25,00","50,00"
9788586932489,190,"NAO VIOLENCIA EXPLICADA, A",JACQUES SEMELIN,COMPORTAMENTO,"R$12,50","25,00"
9788576361145,280,NEUROSE DE CLASSE,VINCENT DE GAULEJAC,SOCIOLOGIA,"R$37,50","75,00"
9788576360735,160,NOSSA VIDA NAO VALE UM CHEVROLET,MARIO BORTOLOTTO,TEATRO,"R$9,00","18,00"
9788576361169,220,PAIXOES TRISTES: RETRATOS CONTEMPORANEOS,ALFREDO NAFFAH E SONIA MANSANO,PSICANALISE,"R$16,50","33,00"
9788576361275,144,PALAVRAS RESISTEM AO TEMPO,ROGERIO SILVA,POESIA,"R$19,00","38,00"
9788576360025,270,PAULISTANO DA GLORIA,"XALBERTO, BIRA CAMARA E SIAN",HQ,"R$11,00","22,00"
9788576360049,230,PECO LICENCA PARA CONTAR,ANA OSTROVSKY,LITERATURA,"R$14,50","29,00"
9788576360681,310,PELOS CAMINHOS DA IGNORANCIA E DO CONHECIMEN,SOONIA PARENTE,PSICANALISE,"R$16,50","33,00"
9788586932472,290,PIERA AULAGNIER. UMA CONTRIBUICAO,MARIA LUCIA VIEIRA VIOLANTE,PSICANALISE,"R$22,50","45,00"
9788576361190,220,POR UMA HISTORIOGRAFIA FOUCAULTIANA NA PSICAN,RLAISFEAEL ALVES LIMA,PSICANALISE,"R$18,00","36,00"
9788576360964,190,PSICANALISE APLICADA NA AMERICA LATINA,ANTONIOS TERZIS,PSICANALISE,"R$17,50","35,00"
9788576361022,145,PSICANALISE E PSICOTERAPIA,RADMILA ZYGOURIS,PSICANALISE,"R$12,00","24,00"
9788586932205,180,"RACISMO EXPLICADO A MINHA FILHA, O",TAHAR BEN JELLOUM,COMPORTAMENTO,"R$13,00","26,00"
9788576360872,220,RAIMUNDO CORREIA MELHORES POEMAS,RAIMUNDO CORREA,LITERATURA,"R$14,00","28,00"
9788586932526,160,"REPUBLICA EXPLICADA A MINHA FILHA, A",REGIS DEBRET,COMPORTAMENTO,"R$14,50","29,00"
"9,78858E+12",220,"SANTOS, UM TIME DOS CÉUS",ANDRÉ BERNARDINO,HQ,"R$19,00","38,00"
9788576360797,260,"SENTIDO E O LUGAR DA INT. NA CLINICA FREUDIANA, O",MARIA VILELA PINTO NAKASU,PSICANALISE,"R$21,50","43,00"
9788576360988,345,SETE VERÕES COM PESSOAS,JOHN KEITH WOOD,PSICOLOGIA,"R$19,00","38,00"
9788586932915,290,"SINTOMA E A CLINICA, O 2 ED",MARIA CRISTINA OCARIZ,PSICANALISE,"R$24,50","49,00"
9788576361107,260,TEVYE O LEITEIRO,SCHOLEM ALEICHEM,LITERATURA,"R$18,00","36,00"
9788576360193,180,"TICO-TICO, O 2ED",EZEQUIEL DE AZEVEDO,SOBRE HQ,"R$18,00","36,00"
9788576360766,410,TRACOS IDEOGRAMATICOS NA LINGUAGEM DOS ANIM,SPATRICIA M. BORGES,HQ,"R$21,50","43,00"
9788576361091,430,"ULTIMO AMOR DE KAFKA, O",KATHI DIAMANT,BIOGRAFIA,"R$29,00","58,00"
9788576360605,110,"URAGUAI, O",BASILIO DA GAMA,LITERATURA,"R$9,00","18,00"
9788586932083,320,USAGI YOJIMBO - SAMURAI,STAN SAKAI,HQ,"R$17,50","35,00"
9788586932922,260,VIAGEM AO PAIS DO NUNCACOMER,SILVIA FENDRIK,PSICANALISE,"R$16,50","33,00"
9788576361138,290,VIDA E MORTE NO BRINCAR,NORMA BRUNER,PSICANALISE,"R$32,50","65,00"
9788586932953,355,"VOZES DA CANCAO NA MIDIA, AS",HELOISA VALENTE,MUSICA,"R$25,00","50,00"
9788586932960,440,ZARATHUSTRA,JERRI DIAS E DANIEL MORAES,HQ,"R$17,00","34,00"
